"","dataset_init[which(dataset_init$service_type == ""Cash Transfer""), ""idea""]"
"1053","Confirmar a través de SMS cual será la fecha en la que realizarán el giro para
evitar ir en la fecha incorrecta, me cobraron. #SAN MATEO #3
"
"1054","Para sentirme más segura de dirigirme hasta el cajero, me gustaría recibir un
SMS de confirmación de disponibilidad del Cash #JERUSALÉN #3
"
"1055","Permitir que el usuario pueda elegir el método de pago de su preferencia, en mi
caso los cajeros no me quedan muy cercanos. #CEREZOS #3
"
"1056","Sería bueno que DRC donara implementos como una silla de ruedas, ya que mi madre
sufre de Artrosis y no tengo como comprarla. #BACHUÉ #4
"
"1057","Asesoria jurídica para encontrar un cupo en una escuela para mi hijo, no tengo
el documento y por eso me niegan el cupo. #LUCERO MEDIO #3
"
"1058","Mi recomendación es visitar a los beneficiarios antes de entregar la ayuda, de
esa forma evitan fraudes y verifican la información. #SUBA #3
"
"1059","Llevar seguimiento a las personas más Vulnerables y si lo requiere complementar
con alimentos, para que no se sientan desamparados. #SUBA #4
"
"1060","Ampliar con más dinero el bono según sus integrantes para comprar alimentos de
mejor  calidad nutricional. #JUAN REY #2
"
"1061","Complementar subsidio económico con kit de aseo personal y bioseguridad ya que
muchas veces nos cuesta comprar esas cosas. #LLANO GRANDE #3
"
"1062","Brindar información clara a los beneficiarios y que mediante un Link podamos
referir a conocidos que estén en vulnerabilidad. #SUBA #4
"
"1063","Charlas en métodos de ahorro para toda la familia, debemos trazarnos una meta de
ahorro para que nos alcance el dinero. #TOBERIN #3
"
"1064","Me parece que cuando nos van a llamar de otra ONG, DRC debe notificar por un SMS
que seremos llamados para no tener incertidumbre. #AURES #2
"
"1065","El espacio para las reuniones es muy reducido recomiendo localizar salones más
grandes para evitar aglomeraciones  #VILLA ELISA #2
"
"1066","Convenios con centro especializados en la atención de niños con síndrome de
down, asistencia en salud, soy madre soltera. #PATIO BONITO #5
"
"1067","Realizar el pago por Efecty ya que en los 2  pagos que recibí  me descontaron al
sacar el dinero del cajero. #BARRANCA #3
"
"1068","Estoy agradecida, pero deben censar en barrios vulnerables priorizando a madres
solteras, por el Covid se les complica trabajar #BILBAO #2
"
"1069","La ayuda me parece buena, pero deberían priorizar a mujeres gestantes y
discapacitados, pues ellos son lo que más lo necesitan #BARRANCAS #4
"
"1070","Recomiendo ser más puntuales con las fechas estipuladas o notificar atrasos, ya
que me debió llegar el 29 y aún no me llega #ALBORIZADORA #2
"
"1071","Priorizar a  discapacitados y Adultos mayores, para que cuenten con el beneficio
y no tarden tanto en darlo, ellos lo necesitan. #LISBOA #4
"
"1072","Quisiera que envíen SMS cada vez que realicen el depósito, me da seguridad para
ir a retirar, el cajero me queda algo lejos. #LA FAVORITA #2
"
"1073","Verificar casa a casa que los beneficiarios en realidad tengan las necesidades
ya expuestas en la encuesta y así evitan fraudes. #PRADO #4
"
"1074","Sugiero que por SMS nos informen anticipadamente la fecha exacta del giro para
no ir varias veces al banco. #SUBA RINCON #2
"
"1075","Colocar un línea a donde llamemos por si dado caso tenemos inconveniente con la
tarjeta, como dudas de manejo y atrasos de pago. #SUBA #4
"
"1076","Mi idea es que NRC nos de información jurídica por Correo, para legalizarme,
poder obtener un trabajo estable y solventarme. #EL CODITO #3
"
"1077","Hacer alianzas con ONG médicas para que cuando nos incorporamos DRC indique cómo
acceder a los servicios de salud gratuitos. #UNIR #3
"
"1078","Que se realicen visitas a los hogares, así saben si realmente la persona
beneficiada requiere de la ayuda, para evitar fraudes. #QUIRIGUA #4
"
"1079","Quisiera que DRC apoye a los emprendedores brindando capacitaciones, en mi caso
de repostería y así podré generar mis ingresos. #CASANDRA #4
"
"1080","Acuerdos con supermercados para comprar con la tarjeta y hagan descuento
especial así alcanzaría para comprar medicamentos #VILLA NUEVA #3
"
"1081","Sedes más centrales en la atención al usuario, el día que fui a reclamar la
tarjeta tome dos buses me queda muy lejos. #ALFONSO LOPEZ #2
"
"1082","Alianzas con centros de salud para realizar campañas en vacunación para los
niños y mujeres en embarazo. #LA PAZ #3
"
"1083","Habilitar en la página oficial un link para ingresar nuevos hogares ya que por
donde vivo hay mas necesitados. #BOSQUE CALDERON #3
"
"1084","Programas en atención a las personas de la tercera edad, entregando calcios y
demás nutrientes que hemos perdido por el tiempo #JERUSALEN #6
"
"1085","Durante el tiempo del beneficio nos podrían capacitar en diferentes áreas, me
gustaría aprender costura para trabajar desde casa #UNIR II #3
"
"1086","Me quedó muy claro cuál es la fecha exacta en la que depositan el Cash, me
gustaría que envíen esa información a través de un SMS #BACHUE #3
"
"1087","Quisiera que ACH brinde posibilidad de realizarnos el hisopado Covid-19 a través
de jornadas en barrios más vulnerables #SAN BERNARDINO #5
"
"1088","Me gustaría que la ayuda puedan extenderla, ya que por la pandemia estoy
desempleado y no tengo como solventar a mi familia. #DIVINO NIÑO #3
"
"1089","Sería de mucha ayuda que DRC compartiera nuestros datos a otras ONG, para poder
contar con otra ayuda cuando esta culmine. #QUIRIGUA #5
"
"1090","Por favor regalarnos la confirmación del depósito a través de un SMS o una
llamada, porque no hay una hora exacta para el pago. #LA PERLA #5
"
"1091","En la encuesta nos permitan referir o recomendar a 1 persona más vulnerable que
nosotros pero que también necesite el beneficio #GAVIOTAS #2
"
"1092","Enviar videos vía WhatsApp sobre los métodos para ahorrar y distribuir bien el
cash porque me parecen que son de mucha ayuda. #ZIPAQUIRÁ #6
"
"1093","Ayuda de ONG para que regalen elementos de aseo para mi padre que lo tengo
hospitalizado con Covid-19, no alcanzo comprarlos. #LIJACA #3
"
"1094","Que avisen por SMS que ya el dinero esta depositado para ir confiados al banco.
#MOCHUELO #2
"
"1095","Colocar una línea de WhatsApp para consultas, quisiera saber cómo podría
inscribirse mi hermana también, pues necesita de la ayuda. #SUBA #3
"
"1096","Estudiar los casos por si la persona tienen una discapacidad o son madre
soltera, entregar la tarjeta directamente a casa. #CERRO NORTE #2
"
"1097","Es buena ayuda la pueden complementar con una entrega mensual de kits de
alimento, así podría invertir el Cash y pagar arriendo #MARTIRES #4
"
"1098","Sería bueno que nos sigan dando charlas por llamadas, en esta ocasión me
gustaría sobre la Xenofobia, muchos vivimos esto a diario. #SUBA #3
"
"1099","Procurar mantener orden con fechas de consignación, me dijeron que el 24 pero
está disponible el 28, avisar mediante SMS #JERUSALÉN #3
"
"1100","En el SMS de aviso incluir el tiempo restante para recibir el beneficio, así
despejamos dudas e inquietudes #SANTA VIVIANA #2
"
"1101","Recomiendo que hagan una llamada mensual de seguimiento para corroborar que
hayamos retirado el cash sin ningún inconveniente. #RINCÓN #3
"
"1102","Me gustaría que así como me avisan de jornadas de atención a madres gestantes,
puedan hacerlo con madres de pocos recursos #GLORIA LARA #2
"
"1103","Gestionar a través de fundaciones herramientas de estudio como tablet, ya que mi
hijo no tiene como ver sus clases virtuales. #BOGOTA #2
"
"1104","A través de vídeos enviados por Whatsapp, nos pueden reforzar la charla
brindada, para invertir  y ahorrar mejor el Cash. #VERBENAL #3
"
"1105","Tardé casi 3 meses en recibir el beneficio, recomiendo determinar a usuarios por
barrios para no colapsar lista de espera #VERBENAL #2
"
"1106","Recomiendo realizar estudios más invasivos para determinar que la persona en
verdad necesite la ayuda económica. #MINUTO DE DIOS #4
"
"1107","Al realizar la encuesta programar 1 visita domiciliaria y tener en cuenta las
condiciones en que viven para asignar el monto. #COSTA RICA #2
"
"1108","Sugiero poder ampliar la ayuda monetaria por 5 meses mas, ya que la situación
por esos paros no puedo vender mis bolsas. #SUBA RINCON #3
"
"1109","Me gustaría que fueran constantes con el envío de SMS de confirmación del
depósito porque solo lo recibí en el primer mes. #SALITRE #2
"
"1110","Me gustaría que orienten a los beneficiarios, a como debemos invertir Cash, para
invertirlo en mi negocio de empanadas. #EDUARDO SANTOS #3
"
"1111","Para generar mayor tranquilidad aería bueno hacer uso de SMS para dar certeza a
los usuarios de disponibilidad del Cash #SUBA GAITANA #3
"
"1112","Que NRC vaya a los barrios más vulnerables y Brinde Kit alimenticio a las
personas que se censaron pero no tienen la ayuda. #EL MIRADOR #5
"
"1113","Dar facilidad de acceso a las personas necesitadas, puede ser a través de un
link para que podamos reenviarlo al que lo requiera. #RINCÓN #5
"
"1114","Notificar por SMS cuando haya atrasos en los pagos y brindar una nueva fecha
para retirar, ya que así no nos dejan con la duda. #BACHUÉ #3
"
"1115","Hacer alianza con Efecty para que también pueda ser método de pago, porque me
toca tomar transporte para ir al cajero. #LUIS CARLOS GALÁN #4
"
"1116","Mi idea es que tengan en cuenta cuando haya paro y realizar los pagos antes, ya
que destruyeron los cajeros, no sé donde retirar. #LISBOA #2
"
"1117","Informar a través de redes sociales y de difusiones en WhatsApp cada cuánto
abren inscripciones al programa, así corremos la voz. #BILBAO #3
"
"1118","Realizar censos en localidades que tienen alta concentración de migrantes, en
Suba por ejemplo, necesitan el beneficio #SUBA #2
"
"1119","Me gustaría que enviaran SMS con la confirmación del depósito cada mes para
movilizarme cuando el pago esté disponible, vivo lejos. #CHÍA #2
"
"1120","Enviar mensajes por WhatsApp alusivos al ahorro para que las familias lo
conviertan en hábitos y tengas metas de ahorro. #ISLA DEL SOL #3
"
"1121","Que NRC tenga convenio con instituciones privadas, ya que de esa manera apoyan
la educación de los niños sin documentación #SAN CRISTÓBAL #2
"
"1122","Al momento de entregar el Cash, tener en cuenta personas de la tercera edad, ya
que no pueden conseguir sustento propio #LAS ORQUÍDEAS #6
"
"1123","Realizar capacitaciones de Carpintería en donde entreguen herramientas, para
tener un trabajo estable y solventar a mi familia. #ALASKA #4
"
"1124","Alianza con otras ONG, considerar programas certificados para fomentar la
formación profesional de migrantes, para apoyarlos #SUBA BILBAO #4
"
"1125","Recomiendo que nos puedan compartir información vía WhatsApp sobre nuevos
programas así podemos participar para una proxima ayuda. #SUBA #3
"
"1126","Podrían realizar visitas casa a casa para que valoren las necesidades de cada
hogar y remitan a otras organizaciones. #VILLA NUEVA #3
"
"1127","Crear un link oficial para averiguar cuando hay nuevas focalizaciones para que
otras familias puedan recibir la ayuda. #TOBERIN #2
"
"1128","Sería de mucha ayuda que NRC tengo alianza con el SENA, para que los jóvenes
logren capacitarse y no anden en tiempo de Ocio. #SUBA #4
"
"1129","ACH suministre canales o rutas de atención a migrantes para orientarnos en
cualquier situación que se presenta #FONTIBON #2
"
"1130","Deseo envíen SMS confirmando la consignación del cash, no sé exactamente el día
que llega y no puedo salir pues tengo 2 hijos. #TRIUNFO #3
"
"1131","Me gustaría que NRC nos regalara a las embarazadas un kit con elementos
necesarios para el primer día del niño. #GRAN COLOMBIA #2
"
"1132","Me parece que NRC nos puede orientar cuando realizan la charla, de cómo podemos
legalizarnos para conseguir un trabajo estable. #USAQUÉN #2
"
"1133","Me gustaría que por medio de un SMS notifiquen el depósito, para que así
tengamos más seguridad al momento de retirar el Cash. #CENTRO #2
"
"1134","Sugiero que antes de entregar el beneficio visiten a los usuarios, para corrobar
si los datos suministrados si son reales. #BARRANCAS #2
"
"1135","Completamentar el beneficio con Kit alimenticio, ya que soy madre de 3 niños y
no tengo un trabajo, sería de mucha ayuda para mi. #EL SOL #3
"
"1136","Sugiero que a los casos de bloqueo de tarjeta sean atendido rápidamente, tuve un
inconveniente y no he recibido respuesta. #SUBA RINCON #2
"
"1137","Propongo que NRC les comparta nuestros documentos a otra ONG para estas nos
sigan brindado ayuda, por mi edad no me dan trabajo. #LISBOA #5
"
"1138","Me gustaría que ACH brinde atención médica a niños, no contamos con seguro
médico para que mi hijo sea atendido #JERUSALÉN #2
"
"1139","Hay falsa información en redes sociales, hacer publicidad en Facebook para
evitar la desinformación y para prevenir fraudes #SANTA ISABEL #3
"
"1140","Sugiero que a través de un SMS nos notifiquen la disponibilidad del Cash, pues
nos daría más seguridad al ir a retirar. #JUAN JOSÉ RONDON #3
"
"1141","Impulsar ideas de emprendimiento dando implementos, sé repostería, para iniciar
me falta batidora y moldes, así genero estabilidad. #SUBA #2
"
"1142","Sugiero dividir el monto y entregarlo en dos partidas ya que no me rinde y no
puedo distribuirlo porque todo se va en arriendo. #ROBLES #3
"
"1143","Me siento insegura retirando el Cash por cajero además de no saber usarlo, en
estos casos entregarlo a través de Efecty #LOS LIBERTADORES #2
"
"1144","Definir y asignar una sola fecha para realizar el giro porque nos informaron una
pero el SMS llega en otra, me tienen confundida. #ALTICO #2
"
"1145","Es útil que cuando nos entreguen la tarjeta podamos disponer de inmediato del
Cash, paso un mes para recibir el primer beneficio. #LISBOA #2
"
"1146","Recomiendo enviar el SMS con días de anticipación ya que llega 3 días después y
me genera dudas #EL CODITO #3
"
"1147","Tomar en cuenta más cantidad de colombianos de la que ya tienen estipulada para
que también reciben el beneficio #CIUDAD BOLÍVAR #3
"
"1148","Informar al beneficiario que organización nos va contactar ya sea en reunión o
SMS porque dijeron no respondiéramos a preguntas #HOGARES #2
"
"1149","Hacer censos en poblaciones vulnerables para dar esta ayuda, muchas personas no
tienen conocimiento de estos beneficios. #SANTO DOMINGO #2
"
"1150","Contar a usuarios a través de WhatsApp otros beneficios que ofrece ACH, para
tener conocimiento y aprovecharlos también #LA FAVORITA #2
"
"1151","Avisar el motivo de convocatoria a charlas, en mi caso sentí mucha incertidumbre
por no saber con que fin me invitaron #OLARTE #2
"
"1152","Sería bueno que al censarnos dieran un folleto donde aparezcan las líneas de
atención, así comunicarnos por cualquier inquietud. #BACHUE #4
"
"1153","Cuando se realice el retiro del Cash notificar a través de un SMS para estar
atentos a los movimientos de la cuenta #VEREDA PANAMA #3
"
"1154","Enviar videos informativos de los cajeros autorizados para realizar el retiro
del Cash y tener siempre esta información #MIRADOR CORINTO #4
"
"1155","Debo tomar transporte para dirigirme al cajero y realizar el retiro del Cash
sugiero utilizar PAGATODOS que están cerca #SAN MATEO #3
"
"1156","Realizar video conferencias una vez al mes para recibir asesorías sobre los
temas tratados en las reuniones y despejar dudas #EL PROGRESO #3
"
"1157","Habilitar puntos de atención en los barrios vulnerables para dar asesoría sobre
como acceder a las ayudas que ofrece DRC. #CARACOLI #5
"
"1158","Crear una aplicación que permita visualizar la consignación del Cash y que no
genere cobros porque no hay fecha fija #EL ARROLLO #3
"
"1159","Realizar constante retroalimentación en temas como puntos de retiro, duración a
través de videos conferencia o SMS #LOS ROBLES #2
"
"1160","Cuando se presente retraso en la fecha de la consignación del Cash avisar con
anticipación y no generar incertidumbre #TOCANCIPA #3
"
"1161","Podrían enviarnos el folleto de manera digital al WhatsApp, ya que éste puede
deteriorarse y perdemos la información valiosa. #LISBOA #4
"
"1162","Dar asesoría comunitaria telefónica en la que resuelvan dudas sobre cómo
legalizar nuestra condición, cada caso es distinto #SANTA HELENA #5
"
"1163","Habilitar un chat de WhatsApp para novedades urgentes con el beneficio, ya que
la comunicación por llamada es imposible #BARRANCAS #4
"
"1164","Por favor enviar SMS con la confirmación del depósito el mismo día que hagan la
consignación, así cumplirían con la fecha. #CORINTIOS 3 #2
"
"1165","Sería bueno que cuenten con una línea exclusiva para brindar orientación, me
gustaría saber como sacar el permiso para trabajar. #MIGUEL #4
"
"1166","Retroalimentar con el beneficiario los temas tratados en las reuniones como
fechas, puntos de retiro y monto a recibir #LIMONAL #3
"
"1167","Contar con un chat interactivo donde un asesor nos oriente en caso de cabios de
clave, daños o bloqueos de la tarjeta #TOCANCIPA #2
"
"1168","Si van a cambiar la fecha de los giros por favor notificar a través de un SMS
porque fui en la fecha acordada y no había saldo. #CEREZOS #2
"
"1169","Que envíen al WhatsApp la grabación de las charlas que dieron antes entregar la
tarjeta, para así tener la información clara #SANTA LUCÍA #3
"
"1170","Me gustaría recibir un aviso de confirmación para disponer del Cash, un SMS
sería buena opción para ir certeramente al cajero #EL CODITO #2
"
"1171","Sería más cómodo para mí recibir un SMS que me indique disponibilidad del
beneficio y dirigirme con certeza al cajero #COLINAS #6
"
"1172","Establecer una fecha exacta para el depósito del Cash, porque he ido al cajero y
este no se encuentra consignado #ELMIRADOR #4
"
"1173","Consignar Cash cada 15 días con el fin de tener acceso a productos y alimentos
básicos porque no me esta alcanzando para el mes #MIRADOR #6
"
"1174","Socializar y acordar con el beneficiario el operador de retiro para que se
escoja por mayor facilidad de acceso un PAGATODO # EL PROGRESO #3
"
"1175","Notificar a través de SMS de texto la consignación del Cash porque este me llega
varios días después de realizar el retiro #LA ISLA #4
"
"1176","Propongo realizar censos casa a casa para favorecer a la población migrante,
este es 1 beneficio que me ha ayudado mucho #RINCÓN DEL LAGO #3
"
"1177","Profundizar más las caracterizaciones, debe ser visitando los hogares y
conociendo sus gastos, para que con esto asigne el monto #VENECIA #3
"
"1178","Coordinar la fecha de envío porque no está llegando en la fecha acordada, a
través de SMS informar cuál será la nueva fecha. #CASUCA #2
"
"1179","Contar con centro de atención fijo donde puedan dar información y puedan
resolver inquietudes de usuarios, sería  muy bueno #SUBA #2
"
"1180","Quisiera que los puntos de reunión sean más cercanos a la zona donde vivo,
quedaba muy lejos donde fui la primera vez y me perdí #USAQUEN #5
"
"1181","Visitar a los usuarios y analizar la posibilidad de darles un apoyo alimenticio,
me quedé sin empleo desde hace tres meses #SANTA VIVIANA #2
"
"1182","Recomiendo agregar al programa bonos canjeables para alimento porque el Cash
solo cubre servicios y alquiler y no para alimentos #MIRADOR #2
"
"1183","Ubicar puntos de atención en los barrios vulnerables, muchas personas quieren
acceder al beneficio y no saben como hacerlo #SIERRA MORENA #3
"
"1184","Corroborar la información dada por los usuarios a través de una visita a los
hogares para que eviten beneficiar al que no necesita. #SUBA #2
"
"1185","Facilitar número de contacto que podamos compartir entre personas de nuestra
comunidad, que notablemente necesitan el Cash #EL CODITO #4
"
"1186","El dinero lo consignan antes de las fechas dichas en la reunión, sería bueno
avisar con un SMS para estar prevenidos #SANTA CECILIA #2
"
"1187","Con un SMS informar que vamos a recibir llamadas de Kuja Kuja, pues así se
generaría tranquilidad para responder a las preguntas. #BACHUE #3
"
"1188","Consulta de disponibilidad del beneficio por página web sería una buena opción
ya que los mensajes pueden llegar a destiempo #EL CODITO #3
"
"1189","Al realizar el censo analizar la posibilidad de recibir copias de documentos, no
tengo como ir a Venezuela a buscar el original #CARACOLI #4
"
"1190","En un futuro realizar un censo en mi comunidad, muchos vecinos no reciben ningún
beneficio y son familias numerosas. #SANTO DOMINGO #2
"
"1191","Me gustaría que al consignar envíen un sms para notificar el depósito, para no
tener que estar yendo a consultar el saldo. #CORINTO III #2
"
"1192","Para recordar los contactos de DRC sería bueno que enviaran folletos digitales
al beneficiarios porque no recuerdo como hacerlo #DUCALES #5
"
"1193","los migrantes que fueron censados y no salieron favorecidos darles una ayuda
alimenticia, no contamos con sueldo fijo. #SANTO DOMINGO #6
"
"1194","Sugiero realizar visitas al participante y validar si realmente necesita la
ayuda y no le quite oportunidad a otros #EL MIRADOR #3
"
"1195","Habilitar línea de WhatsApp para que podamos realizar actualización de datos e
incluir familiares en el núcleo familiar. #CIUDAD BOLÍVAR #4
"
"1196","Tomar en cuenta personas con discapacidad que se postularon para recibir el
Cash, pero no recibieron respuesta alguna #SANTA CECILIA #2
"
"1197","Entregar como complemento un subsidio médico, ya que en un año que llevo en
Colombia no he podido acceder al sistema de salud. #ENGATIVÁ #2
"
"1198","Sugiero crear plataforma virtual que permita consultar el saldo porque vivo
lejos del cajero y así no haría el viaje en vano. #ALTICO #2
"
"1199","Inscribir principalmente a las familias que tienen hijo, para que este apoyo
llegué a fortalecer los ingresos del que si necesita #LISBOA #3
"
"1200","Realizar alianzas con entidades de giros para que sea posible retirar en Efecty,
porque vivo bastante retirada del cajero. #CEREZOS #4
"
"1201","Para evitar aglomeraciones, procurar convocar 30 minutos después de llegar todo
el personal de ACH al sitio de reunión #DIVINO NIÑO #2
"
"1202","Tener convenios con más bancos, sería bueno el único cajero del sector no
funciona me tengo que movilizar a otro barrio #LA VICTORIA #3
"
"1203","Importante tener certeza de disponibilidad del beneficio para no aglomerarse en
cajeros, SMS de aviso es una buena opción #SANTA CECILIA #2
"
"1204","Enviar un SMS notificando la disponibilidad del Cash para dirigirme al cajero
una sola vez y no perder la ida #VEREDA PANAMA #4
"
"1205","Ampliar la cobertura de esta manera favorecer más familias vulnerables de mi
sector, hay muchas personas desempleadas. #SANTA VIVIANA #5
"
"1206","Me gustaría que focalizaran a madres cabeza de hogar y ayudarlas con un bono
alimenticio para redimirlo en supermercados. #SANTA VIVIANA #2
"
"1207","Censar nuevamente en nuestra comunidad para ofrecer la ayuda económica, muchos
vecinos quedaron por fuera y la necesitan. #SIERRA MORENA #2
"
"1208","Divulgar por los medios de comunicación local donde están ubicados los puntos de
atención de DRC mis vecinos lo desconocen. #VILLA SANDRA #5
"
"1209","Crear un programa que brinde ayuda económica a emprendimientos de migrantes así
podrían tener una estabilidad económica. #BONANZA SUR #3
"
"1210","Disponer puntos de orientación al beneficiario para tramitar con rapidez la
tarjeta por perdida ya que se tardan en asignarla #LA ISLA #2
"
"1211","Enviar folletos digitales con información de números de atención en caso de que
se presenten daños o bloqueos de la tarjeta #LA ISLA #4
"
"1212","Apoyar emprendimientos propios con implementos, deseo vender comidas rápidas
pues me encuentro desempleada #LUCERO #2
"
"1213","Que puedan enviar a todos los usuarios el SMS de la confirmación del depósito
pues yo no lo recibo, así iría segura al cajero. #ALTICO #5
"
"1214","Utilizar operadores como EFECTY o PAGATODO que son de fácil acceso y no generan
cobros por manejo o transacción #QUINTANARES #4
"
"1215","En mi comunidad hay un albergue sería bueno que DRC se acerque hasta acá para
censar y brindarle la ayuda a estas personas #SANTA VIVIANA #2
"
"1216","Enviar SMS informativos del buen uso y el paso a paso del cajero electrónico
para prevenir daños o bloqueo de la tarjeta #BALCANES #5
"
"1217","Permitir que recomendemos a personas en situación de vulnerabilidad, conozco
familias con niños que requieren de estos apoyos. #FATIMA #4
"
"1218","Es mejor si el pago se hace quincenal, de ese modo se podría abastecer la
canasta familiar dos veces al mes para que rinda. #VILLA MARIA #3
"
"1219","Para no generar inquietud, sería interesante que nos cuenten cómo consiguieron
nuestro contacto para ser parte de ACH #EL CARMEN #3
"
"1220","Contar con un chat interactivo en tiempo real para consultar sobre temas como
punto de retiro, tiempos y montos de la ayuda #EL ARROLLO #3
"
"1221","Ofrecer brigadas de salud en poblaciones vulnerables, necesito un certificado
médico de mi hija para matricularla en el CDI #LOS CEREZOS #2
"
"1222","Enseñar a los usuarios como se usa el cajero, no sabía cómo utilizarlo y una
trabajadora del banco me tuvo que explicar. #TRES REYES #3
"
"1223","Hacer brigadas en nuestro barrio para focalizar a los migrantes que no reciben
beneficios y darles una ayuda alimenticia. #SIERRA MORENA #4
"
"1224","Enviar SMS de notificación cuando se encuentre disponible el Cash y dirigirme
una sola vez al cajero porque este queda retirado #FLORIDA #4
"
"1225","Sugiero que vuelvan a censar en nuestra comunidad muchas personas en estado de
vulnerabilidad quedaron por fuera de la ayuda. #CARACOLI #2
"
"1226","Realizar alguna alianza con Efecty para que también pueda ser una alternativa de
pago, pues vivo bastante retirada del cajero #LAS CRUCES #2
"
