"","dataset_init[which(dataset_init$service_type == ""Cash Transfer""), ""idea""]"
"1","Sugiero que faltando un mes de la terminación del Cash, verficaran si el hogar
necesita más tiempo de la ayuda. #SAN RAFAEL #2
"
"2","En caso de robo o pérdidas de la tarjeta por favor enviar el reemplazo a
domicilio y nosotros asumimos el costo del envío. #GUACAMAYAS #4
"
"3","Regalar un bono extra para pago de servicios el arriendo y los alimentos son
caros, y estoy quedado con esta obligación. #VILLA MARIA #3
"
"4","Sería positivo tener otra opción para la consignación, me queda lejos el cajero
y aca en mi barrio hay Efecty. #LA ESPERANZA #2
"
"5","Dar una tarjeta para redimirla en supermercados para comprar elementos
personales crema dental, jabón, cepillos. #BOSA BRASILIA #2
"
"6","Obsequiar elementos de primera necesidad para mi hija pañales, pañitos, leche y
ropa, no tengo empleo y el dinero no alcanza. #LA MONTANA #2
"
"7","Me gustaría que ampliarán por 6 meses más el Cash, no es facil conseguir un
empleo. #VILLA MARIA #2
"
"8","Quiero que me den una ayuda económica para fortalecer mi emprendimiento, hay
días que no tengo para comprar insumos. #SECTOR CONCREBLOK #2
"
"9","Regalar elementos de aseo en ocasiones el dinero solo alcanza para el arriendo y
estoy desempleada. #SAN FRANCISCO #2
"
"10","Contar con una línea telefónica para brindar apoyo psicológico a migrantes que
han quedado sin empleo debido a la pandemia. #ALAMEDA #3
"
"11","A futuro analizar la posibilidad de entregar todo el beneficio en una sola
entrega, así el usuario podría realizar una inversión. #SUBA #2
"
"12","Llevar brigadas de salud hasta los barrios vulnerables y focalizar las madres
con niños y brindarles una ayuda alimenticia. #BRITALIA #2
"
"13","Por medio de llamadas verificar como se sienten los usuarios, acabo de perder a
mi esposo y estoy desorientada. #SERRO NORTE #3
"
"14","Enviar información por SMS de otros aliados donde podamos solicitar otra clase
de ayudas humanitarias. #EL CODITO #3
"
"15","Que donarán herramientas de trabajo para montar una venta de comidas rápidas,
tengo experiencia no tengo elementos de trabajo. #LOMBARDIA #3
"
"16","Link en el qué podamos consultar con nuestro documento cómo va el proceso de
selección porque mi mamá lleva 6 meses esperando. #ALFONSO L #3
"
"17","Soy estilista pero no tengo como comprar los implementos para montar mi
barbería, quisiera que me dieran una económica #VILLA GLORIA #2
"
"18","Asesoria jurídica para saber como puedo gestionar el nuevo Estatuto de
Protección al Migrante, con esto puedo trabajar. #VILLA MARIA #3
"
"19","Sugiero que a los usuarios les brinden cursos para que las personas puedan
formarse y así generar sus propios ingresos. #ISLA DEL SOL #2
"
"20","Me gustaría que realizarán censos para focalizar personas que no tienen acceso
al WhatsApp y mucho menos a un computador. #VILLA AMELIA #2
"
"21","Charlas en lactancia materna tengo un niño recién nacido y no he podido
amamantarlo bien no me sale buena leche. #ZIPAQUIRA #2
"
"22","Me gustaría que regalan un kits con elementos de estudio cuardenos, colores,
plastilina, lápices, para mi hijo que estudia. #VILLA MARIA #2
"
"23","Capacitaciones en manualidades y así puedo empezar mi negocio para ayudar
económicamente a mis padres que viven en Venezuela  #EL YUCAL #2
"
"24","Sugiero tener en cuenta a colombianos que están pasando por situaciones
precarias, y puedan ingresar a la organización.  #LAS MERCEDES #3
"
"25","Donar tabletas a familias que tengan niños en el núcleo familiar para que puedan
estudiar porque no tenemos suficientes recursos #CÓRDOBA #6
"
"26","Seguir abriendo convocatorias para que más migrantes vulnerables puedan ingresar
a este proyecto que tanto me ha beneficiado. #POTOSI #2
"
"27","Poder ampliar la ayuda por 3 meses más mi marido y yo estamos desempleados y
esto ayuda a cubrir muchos gastos. #LA ESPERANZA #3
"
"28","Propongo que envíen SMS para informar a los usuarios sobre como acceder a las
capacitaciones que están brindando. #CIUDAD BOLIVAR #2
"
"29","Aliarse con ONG`S para que este tipo de proyectos jamás desaparezcan y puedan
seguir siendo apoyo para la población migrante #S FRANCISCO #2
"
"30","Creo que la tarjeta es 1 método de pago riesgoso y preferiría que fuera a través
de Efecty con 1 código o nuestro documento #SIERRA BUENO #3
"
"31","Cursos en manejo de público me gusta trabajar en eventos, quisiera aprender más
tips y que me certifiquen el curso. #ZIPAQUIRA #3
"
"32","Contar con una línea telefónica para dar asesoría jurídica, quiero sacar el
permiso temporal de permanencia y no sé cómo hacerlo #PARAISO #2
"
"33","Recomiendo realizar 1 estudio más profundo para asignar el monto real del cash,
porque hay personas que no le dan el uso adecuado #POTOSÍ #4
"
"34","Sugiero que se han visibles, por una página oficial para buscar más información
sobre ésta organización, me enteré por vecinos #ZIPAQUIRA #2
"
"35","las personas que no salieron beneficiadas con la ayuda económica deberían
visitarlas para ofrecerles una ayuda alimenticia. #DINDALITO #2
"
"36","Disponer de una línea telefónica para brindar asesoría al usuario sobre donde
puede acercarse para recibir atención médica. #VERSALLES #4
"
"37","Me gustaría que el SMS de confirmación del cash me llegara el mismo día que
realizan el giro, porque lo recibo días después. #SAN CARLOS #3
"
"38","Crear un programa que sirva de enlace con organizaciones para darle la
oportunidad a migrantes de conseguir un empleo digno. #ZIPAQUIRÁ #4
"
"39","Realizar brigadas en mi barrio para darle apoyo a migrantes que viven en
situación de calle y niños en estado de desnutrición. #SAN LUIS #2
"
"40","Sería bueno que siguieran enviando el SMS del deposito del Cash, para ir seguros
ese día al cajero. #LISBOA #4
"
"41","Quisiera que ACH extendiera los meses que va a brindar la ayuda, debido a la
pandemia me quedé sin empleo y vivo arrendada. #SAN CARLOS #3
"
"42","Al entregarnos las tarjetas dijeron que el cajero no iba a descontar nada y no
es así, deberían informar bien a los usuarios #BOSA CENTRO #3
"
"43","Regalar alcancías ya que estoy ahorrando moneditas para los cumpleaños de mi
nieta y no tengo en que guardarlas. #GUACHA #5
"
"44","En los barrios aledaños hay muchas personas necesitadas, sugiero realizar censos
para brindarles la ayuda económica. #SANTA CECILIA #3
"
"45","Soy madre soltera, me gustaría que al finalizar el programa me orienten sobre
como acceder a un beneficio alimenticio. #SANTA RITA #4
"
"46","Regalar bonos para reclamar bolsas de mercado en cadenas éxito, esto ayudaría
mucho a mejorar nuestro día a día. #SAN MIGUEL #3
"
"47","Otorgar un apoyo adicional a las madres gestantes con kits infantiles, así
podamos ahorrar un poco del dinero que nos brindan #EL CARMEN #3
"
"48","Programar el envío del SMS junto con la realización del depósito, en ocasiones
llegan días después de haber retirado el dinero. #EL REDIL #2
"
"49","Me gustaría que notificarán por SMS el día exacto del depósito, me he dirigido
en la fecha estipulada y no he tenido saldo #SUBA GAITANA #2
"
"50","Muchos personas están en lista de espera por distintos motivos, mi sugerencia es
que DRC les colabore con cajas de alimentos #EL PROGRESO #2
"
"51","Bueno que nos informarán sobre aliados que estén brindando ayudas, así en
momentos difíciles sabríamos dónde acudir. #MIRADOR DE CORINTO #3
"
"52","Fortalecer las capacidades laborales de los beneficiarios con cursos de
panadería esto nos serviría para trabajar independiente #COLPAPEL #2
"
"53","Promover el emprendimiento recibiendo proyectos de trabajo y apoyarlos con las
herramientas para que los usuarios puedan iniciar #SANTA FÉ#3
"
"54","Este mes no llegó el mensaje para ir a retirar, deben enviarlo todos los meses,
pues cuando no lo hacen se genera incertidumbre #BILBAO #4
"
"55","Un plan alimenticio en el programa, en el que regalen también productos de la
cesta básica, el cash me alcanza solo para arriendo #RINCÓN #2
"
"56","Me gustaría que nos asignen actividades para aprender y dependiendo del
cumplimiento hacer el depósito, que sea corresponsabilidad #AURORA #
"
"57","Crear una alianza con una farmacia, para que nosotros lo adultos mayores del
programa podamos adquirir medicamentos a bajo costo #S. RITA #6
"
"58","Cuando hayan retrasos en el pago Informarlo de inmediato mediante SMS a los
usuarios, para que no se vayan a preocupar #SANTO DOMINGO #2
"
"59","Informarnos sobre novedades extraordinarias que sucedan de manera mensual, ya
que hubo retraso en la fecha de pago. #ALTOS DE FLORIDA #2
"
"60","Utilizar las redes sociales para informar que ya está el cash disponible, este
es un medio masivo. El SMS no siempre llega. #GACHANCIPÁ #2
"
"61","Enviar vía WhatsApp videos como complemento a las temáticas, de esta manera
fortalecer los aprendido en los videos anteriores. #CARRILERA #2
"
"62","Sugiero que ACH habilite una línea telefónica para brindar asesoría de como
acceder al permiso temporal de permanencia. #SIERRA MORENA #4
"
"63","Al final del programa incluirnos en base de datos, la cual sea dada a otra ONG
para que sigamos recibiendo apoyo de alguna forma #CARMEN #3
"
"64","A mí me gustaría que realizaran reuniones cada mes, en donde nos enseñen a
administrar el dinero de forma que generemos ingresos #BELÉN #3
"
"65","Una ayuda que nos beneficiaría mucho es que nos pudieran entregar en el proyecto
donaciones de Ropa más que todo a los niños. #LIMONAL #5
"
"66","Sería muy positivo que hagan un barrido en los barrios mas vulnerables y logren
estas personas ser beneficiarias de esta ayuda #TOCANCIPÁ#3
"
"67","Extender el proceso de entrega del cash, para incluir la opción de visitas
domiciliarias antes de otorgar el beneficio. #SAN HUMBERTO #2
"
"68","Habilitar un chat interactivo en el que sea mas fácil comunicarnos con NRC, ya
que es complejo contactarnos con ellos. #ROSARIO #3
"
"69","Trabajo en una venta de comidas rápidas pero quiero montar mi negocio, ACH
debería dar incentivos para apoyar estas ideas. #VILLA CELINA #3
"
"70","Completamentar el beneficio con Kit alimenticio, pues soy sola y madre lactante,
se me ha hecho difícil poder trabajar. #BELLO HORIZONTE #2
"
"71","Antes de realizar una llamada de parte de DRC, deberían enviarnos un mensaje de
texto anticipándolo, para que estemos pendientes #RINCÓN #3
"
"72","Realizar una llamada a la personas no seleccionadas, en donde les informen las
razones y para que nos sigan a la expectativa #BILBAO #2
"
"73","Sugiero que a las personas de la tercera edad nos extiendan el tiempo para
recibir el beneficio, en éstos momentos vivo sola. #VICTORIA #6
"
"74","Que la organización avise por SMS con antelación cuando otras empresas nos van a
llamar, cada vez que me llaman estoy ocupada #EL CARMEN #2
"
"75","Sugiero que en la entrega de tarjetas den un apoyo de transporte a los usuarios
que vivan más lejos, para retornar a casa #EDUARDO SANTOS #4
"
"76","Mi recomendación es Realizar visitas a los beneficiarios para confirmar si
verdad necesitan la ayuda y evitar los engaños. #TUNJUELITO #2
"
"77","Apoyar los emprendimientos de los usuarios para ayudar a generar empleo y puedan
tener un mejor estilo de vida. #ALBORIZADORA ALTA 2 #2
"
"78","Al asignar el lugar para hacer el retiro deberían tener en cuenta el lugar de
residencia del usuario, el cajero está muy lejos. #SAN LUIS #2
"
"79","Procurar realizar los depósitos siempre en la misma fecha (28), para qué los
usuarios no tengan que estar consultando el cajero #EL PLAN #5
"
"80","Deseo recibir orientación de a dónde puedo acudir para solicitar cupo
estudiantiles para mis hijos, tienen 2 años sin estudiar #E. SANTOS #3
"
"81","La ayuda es muy buena, lo único que sugiero es que sigan enviando el SMS de
confirmación para ir con la seguridad de retirar #VILLA MARIA #4
"
"82","Asesoria legal se me venció el PEP y no se como actualizarlo, lo necesito
urgente para seguir trabajando. #BARRANCA #5
"
"83","En los SMS que nos envían también facilitar los links de las redes sociales de
la organización, para seguirlos y estar actualizados #SUBA #2
"
"84","Dictar cursos de perfeccionamiento de habilidades, me gustaría recibir uno
intensivo de manicura para aumentar mis conocimientos #RINCÓN #3
"
"85","DRC podría tener puntos de referencia con asistencia médica para la población
migrante, ya que es un beneficio escaso. #EL PROGRESO #2
"
"86","Me gustaría validar mi colegiatura, propongo que DRC nos envíe una ruta por SMS
de instituciones que nos pueden ayudar en esto. #OASIS #4
"
"87","Hacer una campaña de información a los migrantes sobre el nuevo documento al
cual nos podemos acoger para estar tranquilos. #SOL #2
"
"88","Expandir los cupos para brindar el beneficio, así los colombianos también
podrían obtener esta ayuda económica. #SAN BERNARDINO #3
"
"89","Mejorar el link en el que se puede consultar el saldo por para que éste nos de
acceso, aunque intentamos no podemos ingresar #EL TUNAL #2
"
"90","Cuando finalice la ayuda orientar al usuario con talleres que permita creación
de pequeños negocios y obtener un trabajo estable #3 REYES #3
"
"91","1 línea telefónica que podamos facilitar a familiares y amigos no inscritos en
el programa, para que por allí soliciten participar #SUBA #4
"
"92","Realizar brigadas en las poblaciones vulnerables para dar ayuda a personas a
través de subsidios alimenticios y apoyo psicológico #SOACHA #2
"
"93","Adicional puedan tener entregas económicas para proyectos de emprendimiento, ya
que me gustaría vender comidas rápidas. #LOS CEREZOS #3
"
"94","Sería muy positivo que al comprar con la tarjeta hagan descuentos, para ello
podrían hacer convenios con los supermercados. #CHUSCAL #3
"
"95","Primero deben visitar el hogar del participante antes de otorgarle el beneficio,
ese sería un filtro más efectivo en el programa #CARMEN #3
"
"96","Sería bueno que en la caracterización identifiquen las necesidades educativas y
posteriormente remitirnos a instituciones. #GACHANCIPA #3
"
"97","Deseo recibir una oportunidad de estudio, podrían crear convenios con alguna
empresa que nos pueda brindar cursos certificados #QUIRIGUA #2
"
"98","Quisiera que me dieran más información de ACH Por medio de un correo, ya que
quiero conocer más de esta ONG que me ha ayudado #MONTEBELLO #5
"
"99","Abrir una línea de atención adicional para que otras personas puedan obtener
información de cómo acceder al beneficio. #LA FLORIDA #4
"
"100","Campañas de inscripciónes casa a casa de familias vulnerables, así ellos tendrán
la oportunidad de obtener este apoyo. #LA CRISTALINA #3
"
"101","Dar la posibilidad de elegir el medio para recibir la ayuda, sería mejor Efecty,
el cajero cobra y eso es dinero que sirve. #PABLO #4
"
"102","Siento que cada dos meses DRC podría hacer reuniones por una aplicación virtual,
para estar al tanto del uso que le dan al cash. #EL LAGO #2
"
"103","Me gustaría que DRC nos pudiera ayudar con programas escolares para nuestros
niños, ya que mis hijos están sin estudios. #LOS CEREZOS #3
"
"104","En la encuesta identificar a los emprendedores y posteriormente brindar charlas
para que fortalezcan su emprendimiento. #TOCANCIPÁ #2
"
"105","Dictar cursos en panadería ya que este trabajo tiene muchas oportunidades de
empleo, quiero tener mis propios ingresos. #SANTA ISABEL #2
"
"106","Si al momento de verificar los documentos el usuario no dispone de los
originales, aceptar las copias para otorgar el beneficio #LA ISLA #3
"
"107","Corroborar la información suministrada haciendo visitas a las viviendas, hubo
quienes ingresaron personas que no viven en casa. #CORPABIS #2
"
"108","Propongo orientar a los beneficiarios por charlas al buen uso de la tarjeta,
para que como yo inviertan y puedan sacar provecho #LA PLAYA #3
"
"109","Al estipular el monto a recibir de las familias, sería apropiado tener en cuenta
el # de integrantes que la conforman. #PATIO BONITO II #5
"
"110","Realizar brigadas en nuestra comunidad para censar a mis vecinos hay muchas
personas desempleadas necesitando esta ayuda. #BOSA PORVENIR #3
"
"111","Considerar tener una línea de acceso directo, para cuando pasen percances
tengamos una respuesta rápida y una pronta solución. #FLORESTA #4
"
"112","Avisar a través de un SMS que seremos llamados por otra ONG, así podremos
contestar de manera tranquila y sin incertidumbre #PATIO BONITO #2
"
"113","Convenios con el SENA para que dicten cursos a los jóvenes y estos puedan tener
mas oportunidades laborales. #TOCARINDA #2
"
"114","Lo que propongo es que las consignaciones las hagan quincenalmente, para cubrir
los gastos que se generen a mediados de mes #RICAURTE #2
"
"115","Implementar bancos de alimentos a su proyecto, esto nos ayudaría a mejor aún más
nuestra necesidad de abastecimiento. #MINUTO DE DIOS #3
"
"116","Regalar bolsas con elementos de aseo, en ocasiones solo alcanza el dinero es
para arriendo y quedan pendienes otras cosas.  #VILLA MARIA #2
"
"117","Charlas motivacionales para  jovenes ya que no tienen un rumbo definido y puedan
emplear el tiempo libre en algo productivo #CONCEPCION #3
"
"118","Me gustaría recibir el mensaje de confirmación del depósito para ir con la
seguridad que ya está el dinero disponible. #CAMINO #3
"
"119","Como ya sabemos que la ayuda dura 6 meses, podrían complementar en los 2 últimos
meses con Kit alimenticio, no tengo un trabajo. #POTOSÍ #4
"
"120","Cuando hayan retrasos con la ayuda, sería bueno que por vía telefónica se
comunicaran con los usuarios para aclarar la duda. #SANTA LUCÍA #2
"
"121","Mi única sugerencia es que entreguen un folleto con información de cada socio
para que en caso de necesitarlo, acudir a ellos. #CANAVITA #3
"
"122","Recomiendo realizar censo con más frecuencia, en especial en mi comunidad, pues
veo muchas madres que necesitan la ayuda. #SAN JOAQUÍN #4
"
"123","Reforzar mediante vídeos a WhatsApp el uso de la tarjeta, sería de ayuda, porque
tengo conocidos que no saben manejarla. #ISLA DEL SOL #3
"
"124","DRC podría dirigirnos hacia otras ONG según la necesidad que pase la persona
(Educación), puesto que la situación está difícil #SAN MATEO #4
"
"125","Habilitar un correo electrónico para postulación de referidos, allí enviemos
datos de familias que necesiten recibir el beneficio #CARMEN #4
"
"126","Los alimentos están a precios muy costosos, DRC podría hacer donaciones de kit
alimenticio así nos ayudarían en este tiempo. #MANZANO #5
"
"127","Sugiero que le hagan acompañamiento psicológico a los jóvenes pues se encuentran
desorientados y sin ánimos de salir adelante. #SUESCA #2
"
"128","Junto con la ayuda del Cash sugiero entregar bonos de mercados para que el Cash
alcance para los pagos de arriendos y servicios #VENECIA #3
"
"129","Soy una persona de avanzanda edad y estoy desempleada, me gustaría que al
terminar el beneficio, me den un ayuda alimenticia. #CENTENARIO #6
"
"130","Determinar el valor de acuerdo a las necesidades del hogar ya que pueden haber
situaciones que generan mas gastos. #SANTA RITA #3
"
"131","Que apoyen con cursos y capital semilla a personas que desean ser emprendedores,
esto sería ideal para que no depender de ayudas. #AMPARO #5
"
"132","Que ACH tengo un convenio con EPS para los niños y la 3 edad que sufrimos de la
tensión podamos recibir un chequeo más continuo. #KENNEDY #4
"
"133","En familias donde hay miembros en condición de discapacidad brindarles un bono
adicional que sea solo para medicamentos o salud. #BILBAO #3
"
"134","Mi sugerencia es que complementen la ayuda con cursos, esto nos beneficia a
largo plazo pues podríamos conseguir un empleo. #LAS FLORES #4
"
"135","Quisiera que el SMS que nos envían del pago fuera más detallado con el monto que
fue consignado, así saber cuánto retirar. #LIMONAR #5
"
"136","Habemos personas ya mayores con problemas de salud (DIABETES) DRC también podría
abrir espacios con asistencia médica. #LA ISLA #4
"
"137","Realizar casa a casa la encuesta socieconómica para verificar si en realidad
necesita el Cash. #VILLA MARIA #2
"
"138","Mi sugerencia es enviar un Correo a las personas que no recibieron, informando
cuando vuelven reelegir y que esperen paciente #TUNJUELITO #2
"
"139","Crear un programa que apoye las ideas de negocio de los migrantes, quiero montar
una microempresa de arepas y empanadas. #SANTA RITA #3
"
"140","Considero que deben coordinar el mensaje con la fecha en la que realizan el
depósito, así no generan esa incertidumbre. #MARIA PAZ #2
"
"141","En el primer pago adelantar algunos meses para generar una inversión, para
establecer un negocio y poder trabajar en ello #EDUARDO SANTOS #2
"
"142","Brindar cursos a usuarios que deseen aprender algún arte durante los 6 meses,
particularmente desearía saber algo de repostería #PRIMAVERA#3
"
"143","Que ACH Apoye a los emprendedores ya sea entregando las herramientas, en mi caso
me gusta la repostería pero no tengo como ejercer #GALAN #2
"
"144","Alianzas con supermercados como el Éxito, para que a quienes paguen la tarjeta
nos hagan descuentos, por ser usuarios de DRC #BACHUE #3
"
"145","Quiero evitar descuento por estar consultando saldo enviar un SMS con la novedad
de que el dinero está a nuestra disposición #QUINTANARES #2
"
"146","A familias más vulnerables entregar bolsas con mercados mensuales, pues a muchos
solo nos alcanza el dinero para pagar el arriendo #RINCÓN#4
"
"147","Opinó que la caracterización la hagan de manera presencial para ver la condición
en la que se encuentra el postulante. #EL PROGRESO #4
"
"148","Disminuir el tiempo que demoran en el evento de la entrega de tarjetas a 1 hora,
ya que muchos tienen prisa para ir a trabajar #BOCHICA #3
"
"149","A las familias numerosas entregarles un apoyo adicional, un bono de alimentos
podría ser un gran complemento al dinero. #SAN PEDRO #2
"
"150","Asesoria jurídica para apostillar mi título en primera infancia tengo
experiencia más 15 años, me gustaría ejercerla. #VERGANZO #4
"
"151","Hay meses que no envían el SMS para notificar el depósito, considero que siempre
deben hacerlo, así sabría cuando ir retirar #PALERMO SUR #2
"
"152","Censar en barrios vulnerables, hay muchas personas que no tienen conocimiento de
estas ayudas, ni como acceder a ellas. #CIUDAD BOLÍVAR #2
"
"153","Seria bueno que remitan nuestros datos a una organización de salud para que
hagan jornadas con los beneficiarios. #ROSARIO #3
"
"154","A las personas que van a dejar de recibir la ayuda económica deberían brindarles
una ayuda alimenticia durante algunos meses. #LOS PINOS #2
"
"155","No aprobar el beneficio hasta que se realice una visita al hogar del usuario,
porque muchos salen beneficiados sin necesitarlo #S. LUCIA #3
"
"156","ACH debería realizar censos en los barrios vulnerables para darle ayuda a muchas
personas que no tienen acceso a un computador. #FONTIBON #2
"
"157","Creo que la mejor manera de ayudarnos es brindarnos capacitaciones de
gastronomía y así cuando todo culmine salir adelante. #EL PARAÍSO #3
"
"158","Me gusta la cocina, quiero montar mi propio restaurante ACH debería apoyar las
ideas de negocio que tienen los usuarios. #BELLO HORIZONTE #2
"
"159","Sería genial que nos puedan apoyar con implementos educativos ya que normalmente
no nos alcanza para todo lo que piden. #FLORIDA #2
"
"160","Mi idea es que también nos puedan colaborar con algunos implementos (COCINA) ya
que quisiera montar mi propio restaurante. #SAN NICOLÁS #2
"
"161","Me gustó la charla de la reunión, podría reforzarlas con Videos a WhatsApp, así
tenemos más presente las formas de mejorar. #ALBORIZADORA #3
"
"162","Que haya más inclusión de colombianos vulnerables al programa, noto que la gran
mayoría de beneficiarios son venezolanos #SIERRA MORENA #2
"
"163","Soy madre soltera estoy desempleada, me gustaría que ACH analice la idea de
extender algunos meses la duración del beneficio. #RAMAJAL #4
"
"164","Sugiero avisar por un SMS con anticipación sobre inconvenientes que tengan con
los pagos, así evitar expectativas cada mes. #SAN HUMBERTO #2
"
"165","Sugiero que podamos utilizar un banco que no descuente por la transacción, ya
que nos descompleta el pago del arriendo #ARBORIZADORA ALTA #3
"
"166","Entre los vídeos que envían incluir 1 al inicio del programa en donde se vea
cómo usar el cajero, para quienes no sepan hacerlo #E. SANTOS#4
"
"167","Tener en cuenta a mujeres cabeza de hogar para darles además de la ayuda
económica una asesoría como montar su negocio propio #BELLA FLOR #2
"
"168","Propongo que al realizar el depósito envíen un SMS de texto para notificar a los
usuarios, así podría ir confiada hacer el retiro #TESORO #2
"
"169","Mi aporte es que en las convocatorias también puedan recibir y otorgarle el
beneficio a colombianos ya que también necesitan #LOS CEREZOS #3
"
"170","Vía WhatsApp envíar información importante para los migrantes, ejemplo: trámites
y requisitos para estar legalmente aquí. #PATIO BONITO #3
"
"171","Sería bueno que entreguen cartillas y una alcancía para enseñarles a los niños
el hábito del ahorro e iniciar a ahorrar. #CANAVITA #2
"
"172","Cursos en panadería y le podríamos sumar que regalarán los materiales para
iniciar nuestro propio negocio. #SAN PEDRO #2
"
"173","Obserquiar durante estos 6 meses de ayuda con 3 bolsas de mercados intercaladas
y así podría pagar servicios estoy atrasada. #AURES #3
"
"174","Líneas de WhatsApp de respuesta rápida, para cuando se presenten inconvenientes
con la tarjeta podamos obtener respuesta pronta #VENECIA #2.
"
"175","Contar con un chat en línea donde den respuesta de las inquietudes que surjan
del programa como tiempo de duración de la ayuda #RINCON #2
"
