"","dataset_init[which(dataset_init$service_type == ""Cash Transfer""), ""idea""]"
"704","Tener seleccionados a las personas de la tercera edad, para que DRC nos pueda
hacer un seguimiento y donarnos alimentos. #LOS CEREZOS #6
"
"705","Me gustaría incluyeran a más cantidad de Colombianos en el programa, hay muchos
que por la pademia pasan hambre #PATIO BONITO #3
"
"706","La inscripción se hagan directamente de la página de DRC, así evitar que
inescrupulosos se aprovechen de la necesidad. #SANTO DOMINGO #3
"
"707","Me gustaría que hagan entrega de cartillas educativas para que en casa junto a
nuestros niños aprendamos cosas nuevas. #3 ESQUINAS #3
"
"708","Nos den la opción vía telefónica para hacer actualización de residencia en los
datos, nos facilitarían el proceso de cambio #VILLA SANDRA #4
"
"709","Sería bueno que nos suministren una lista de lugares donde se consigan los
alimentos a mas bajo costo, así nos rendiría el cash. #TOBERIN #4
"
"710","En el punto donde nos entregan la tarjeta y nos dan la charla sería bueno que
nos donaran tapabocas o implementos de bioseguridad #CODITO #3
"
"711","Complementar las ayudas entregando kits para bebés, por su alto costo me es
difícil adquirir la leche fórmula y pañales. #SANTA VIVIANA #2
"
"712","Sería bueno ampliar por 4 meses más  la ayuda económica ya que por estos paros
no se ha podido trabajar tranquilamente #LA ESMERALDA # 3
"
"713","Fuentes de empleo dentro de NRC, realice capacitaciones en atención al cliente y
me gustaría trabajar con la organización #VILLA MARÍA #3
"
"714","Habilitar un página para hacer actualización de datos, me mudé de casa y
quisiera que tengan mi nueva dirección. #QUIRIGUA #3
"
"715","Facilitar información importante dada en charlas a través en correo electrónico,
así podamos tenerla a la mano #CARACOLI #3
"
"716","DRC nos pueda apoyar con capacitaciones de emprendimiento, así tendríamos una
orientación para iniciar un negocio. #SANTO DOMINGO #4
"
"717","Más personas encargadas en la selección de los beneficiarios, en mi caso tuve
que esperar 8 meses al Cash y es mucho tiempo #SOTAVENTO #2.
"
"718","Sería bueno que se pueda ingresar a nuevas personas ya que después de la
encuesta han llegado personas a vivir en casa. #BOSA LINDA #2
"
"719","Realizar acompañamiento a los adultos mayores, así nos brindan orientación sobre
el acceso a servicios de salud, entre otros. #ELISA #6
"
"720","Poder acceder a la cuenta bancaria para revisar cuando consignen, entro al link
que nos dieron pero a sido imposible ingresar. #BILBAO #4
"
"721","La situación actual es mucho más crítica por eso considero que deberían
complementar la ayuda entregando un kit de alimentos. #BILBAO #3
"
"722","Podrían incluir asistencia médica dentro del proyecto de NRC, mis hijos
requieren de dicha atención y no se donde acudir #LA BOMBONERA #3.
"
"723","Me gustaría que complementaran la ayuda con bolsas de alimentos, ya que sólo
puedo pagar arriendo #RINCÓN DEL DIAMANTE #4
"
"724","Tener personal adicional para la selección de los beneficiarios, así el tramite
para asignar la ayuda sería menos tardío #SAN ANTONIO #2.
"
"725","Enviar confirmación del depósito a través de correo electrónico porque siempre
me toca llamar y preguntar si ya depositaron. #VILLA CINDY #2
"
"726","Crear grupo de WhatsApp para dar información sobre el manejo de violencia contra
la mujer ya que no sabemos a donde llamar. #SAN JUANITO #2
"
"727","Me gustaría mucho que este apoyo viniera acompañado con kit de alimentos, pues
el Cash no es suficiente, estoy desempleada #SAN LORENZO #2
"
"728","Para que este programa pueda beneficiar a más personas considero permitir a cada
usuario sugerir una familia vulnerable #VILLA DE GRANADA #3
"
"729","Con un mensaje notificarnos que se cambia la fecha del depósito así nos evitan
la incertidumbre que genera la espera. #SANTA VIVIANA #3
"
"730","No tengo muy claro aún durante cuánto tiempo voy a recibir la ayuda quisiera que
en un SMS nos dijeran lo que falta. #SANTA CECILIA #4
"
"731","Realizar charlas sobre nutrición a menudo y seguido de esto regalar kit de
vitaminas para los niños en bajo peso. #NUEVA ZELANDIA #3
"
"732","Sugiero que hagan censos 3 veces en el mes, para darle oportunidad a más
familias de recibir el apoyo económico queda DRC. #EL ALTICO #2
"
"733","Sería bueno que la caracterización sea mas amplia para que identifiquen todas la
necesidades y luego brinden orientación. #QUIRIGUA #2
"
"734","Sería mas completo si hicieran acompañamiento a los beneficiarios, pues no se
trata solo de dinero, también sentirnos apoyados. #QUIRIGUA #3
"
"735","Enviar el SMS donde informan que ya se hizo el depósito, normalmente no llega y
debemos ir a la suerte a consultar. #SANTA VIVIANA #3
"
"736","De ocasionarse algún retraso para el pago, por favor informar por medio de SMS
para dar tranquilidad y confianza al usuario #OASIS #3
"
"737","Notificar que ya disponemos del Cash a través de una llamada, de esa manera
podrían resolver alguna duda que presentemos. #ISLA DEL SOL #3
"
"738","Cuando el Cash no llegue en la fecha estipulada podrían notificarnos qué día ha
sido asignado el depósito, evitan zozobra. #LAS GRANJAS #4
"
"739","Aún tengo duda si es durante 6 meses o 3 meses, por lo que es mejor que nos
envíen un WhatsApp con esta información para saber. #BERBENAL #3
"
"740","Es necesario que DRC disponga de líneas telefónicas para que migrantes puedan
acceder a estos beneficios rápida y fácilmente. #EL CARMEN #4
"
"741","Procurar cumplir con la fecha del Cash pues actualmente con eso dispongo para el
arriendo, el señor donde vivo no es muy tolerante. #SUBA #3
"
"742","Poca comunicación ya que no me entero cuando depositan y para nosotros es muy
importante que esto pase, así podemos salir. #BERBENAL #3
"
"743","Charlas en prácticas de ahorro para toda la familia y regalar alcancías para
crear estos buenos hábitos #SUBA LISBOA #4
"
"744","Corroborar la información por medio de visitas de esa manera pueden evitar
beneficiarios fraudulentos, hay gente que no necesita. #PARIS #3
"
"745","Mayor organización previa al pago para que puedan cumplir con las fechas
establecidas o en su defecto darnos la nueva fecha. #LA ESTRADA #3
"
"746","Hacer 3 visitas para corroborar la información, verificar el avance de la ayuda
y conocer las condiciones en que finalizamos. #QUIRIGUA #4
"
"747","Notificar vía SMS cuando el deposito este disponible, de esa manera me evitaría
el traslado innecesario al cajero #SUBA SALISTRE #3.
"
"748","Líneas telefónicas efectivas para la comunicación, es bastante complejo lograr
tener un contacto con ellos. #SOACHA #2
"
"749","Tener puntos móviles con apoyo Psicológico en las distintas zonas, muchas
personas necesitan de esta atención por depresión. #FLORIDA #4
"
"750","Completar este apoyo más adelante con entrega de alimentos, puesto que la
situación que vivimos nos complica abastecernos. #LOS CEREZOS #3
"
"751","Crear un programa alterno en dónde nos capaciten en peluquería, así podemos
implementar el Cash en la creación de negocio #VILLA GLORIA #3
"
"752","Crear un sistema donde no se repitan las ayudas para ingresar nuevos hogares
necesitados, hay muchas familias vulnerables. #VERBENAL #5
"
"753","Que puedan agilizar el proceso de entrega de la tarjeta ya que se dé muchas
personas que lo están esperando y lo necesitan. #EL CARMEN #4
"
"754","Tener alianzas con centros médicos para realizar exámenes ya que me encuentro
embarazada y no logro hacermelos todos a tiempo. #GUIKANY #2
"
"755","El sector donde vivo es muy necesitado, hacer caracterizaciones para que según
el nivel de vulnerabilidad se ayude prontamente. #MIRADOR #5
"
"756","Por medio de SMS dar consejos para mejorar nuestros hábitos alimenticios y así
mismo tener una vida saludable, tengo 2 hijos #LA ESPAÑOLA #2
"
"757","No recibo notificación alguna cuando está disponible el dinero, me gustaría
recibir un SMS para dirigirme al cajero #SAN FRANCISCO #3
"
"758","Como complemento entregar bonos de alimentos a las familias mas vulnerables, ya
que en su mayoría solo alcanza para arriendo. #MARIA #2
"
"759","Es más cómodo tener certeza de disponibilidad del beneficio a través de un SMS o
llamada que confirme fecha de pago #NUEVA COLOMBIA #5
"
"760","Crear grupos de WhatsApp con los beneficiarios de los otros socios para generar
espacios de diálogo y compartir información #ISLA DEL SOL #2
"
"761","Muchos de los beneficiarios estamos de forma legal, me gustaría que DRC hiciera
una jornada de empleo para estas personas. #FLORIDA #3
"
"762","En la inscripción del núcleo familiar, puedan recibir una copia del documento de
cada persona a veces no tenemos el original. #BALCANES #4
"
"763","Realizar una gran alianza con otras organizaciones para que el programa abarque
todos los ámbitos familiares. #SANTA LUCIA #4
"
"764","Como madre primeriza me gustaría que dieran algunas charlas acerca de crianza y
cuidados del bebé, sería maravilloso #MINUTO DE DIOS #2
"
"765","Por  medio de SMS notificarme el día de la consignación para ir seguros al
cajero solo me llego la primera vez. #SUBA RINCON #4
"
"766","Charlas psicológicas para mejorar mi estado emocional y el de todo mi hogar, así
podremos avanzar como un equipo.  #EL CODITO #3
"
"767","Cuando entregan la tarjeta del banco deberían regalar bolsas de mercado ya que
el pago no es inmediato. #LISBOA #5
"
"768","La entrega de la tarjeta debería ser a través de una visita así corroboran la
información y brindan más seguridad en el proceso #SANTA FE #2
"
"769","Incluir asesoría relacionada al acceso laboral, considero es la mejor manera de
ayudar al extranjero a tener un estabilidad #SUBA BILBAO #4.
"
"770","Mi propuesta es que para darle paso a otras personas DRC, pueda reducir los
meses pero con la misma cantidad de dinero #LUIS CARLOS GALAN #4
"
"771","Un mayor acercamiento por parte de NRC a las comunidades, muchos desconocen su
existencia y estan necesitando de ayuda #SUBA BILBAO #3.
"
"772","Para evitar descuento del dinero por hacer varias consultas en el cajero, sería
bueno que nos avisarán del pago por un SMS. #LOMA LINDA #4
"
"773","Creo que sería bueno que nos orientarán a través de charlas sobre todo el
proceso nuevo de legalización, estoy interesada. #CEREZOS #4
"
"774","Alianzas con organizaciones para ayudar con medicamentos para embarazadas, ácido
fólico, hierro y suplementos vitamínicos. #EL CODITO # 2
"
"775","Un convenio con el banco para que ellos no cobren comisión cada vez que se
retira, ya que se descuenta de la tarjeta siempre. #CLARET #2
"
"776","Dentro del proyecto realizar talleres para enseñar la pastelería, soy repostera
y me gustaría colaborar para dar clases #TRANQUILANDIA #3.
"
"777","Usar otra plataforma de retiro, preferiría Daviplata,  ya que el cajero me
descuenta y es más peligroso retirar allí #EL TESORO #3
"
"778","Asesorar a los jóvenes que desean emprender, de esta manera seríamos
independientes y generadores de empleo e ingresos. #CARACOLI #2
"
"779","Enviar el SMS donde informan que ya se gizo el depósito, normalmente no llega y
dedemos ir a la suerte a consultar. #SANTA VIVIANA #3
"
"780","Colocar un punto físico, sería más sencillo para la población exponer sus casos
para recibir este apoyo económico. #CORINTIOS #4
"
"781","Crear una plataforma que sea solo para el funcionamiento de inscripciones,
teniendo en cuenta que las personas buscan apoyo. #LIMONAR #2
"
"782","Reducir el tiempo de servicio a la mitad para que el monto mensual llegue por
una cantidad doble y alcance para todos los gastos #ROBLES #2
"
"783","Realizar las consignaciones cada 15 días a los usuarios que deben pagar alquiler
a diario, para que no se les acumule la deuda #FLORIDA #3
"
"784","Realizar talleres prácticos en proyectos de emprendimiento; en peluquería tengo
experiencia y necesito maquinarias en general. #ZIPAQUIRA #3
"
"785","Verificar los datos entregados por los usuarios por medio de visita sociales, de
esta manera se puede prevenir el fraude. #SAN ISIDRO #2
"
"786","En Alianza con otras ONG pueden facilitarnos el acceso al servicio médico, no
recibo atención desde que estoy en Colombia. #SIERRA MORENA #2
"
"787","Recibir ayudas en útiles escolares ya que mis hijos necesitan materiales,
cuadernos, colores, lapices y colbón. #CORINTO #3
"
"788","Sería mejor que depositen en EFECTY ya que en el banco cobran por cada consulta,
la última vez me descontaron 10.000. #FATIMA #3
"
"789","Crear programas para emprendedores, sería muy satisfactorio para salir adelante
por nuestra cuenta durante la pandemia #SUBA RINCÓN #4.
"
"790","Visitar a usuarios para conocer si realmente necesitan el beneficio, para
brindar la oportunidad a otros más desfavorecidos #CARACOLI #3
"
"791","Debido a la difícil situación que estamos viviendo, quisiera que consideraran
extender un poco más de tiempo el beneficio #DIVINO NIÑO #2
"
"792","Alianza con organizaciones donde brinden charlas sobre la crianza y
acompañamiento a los jóvenes en tiempos de pandemia. #SUBA RINCÓN #3
"
"793","Crear un aplicativo en el cual nuevas personas puedan registrarse, hay
comunidades que no tienen idea como ser parte de NRC #VILLA ELISA #2.
"
"794","Comunicarse nuevamente con las personas que no han salido seleccionadas, muchos
de ellos realmente necesitan el beneficio #AV. 56 SUR #3
"
"795","Mediante llamadas informar que ya está el dinero disponible, así vamos con la
seguridad de que si se podrá retirar. #ROBLE SUR #2
"
"796","Tener una línea gratuita para darnos información de cuando abren nuevos cupos ya
que tengo familiares interesados. #EL CHORILLO #5
"
"797","Tratar de incluir a todos los usuarios para el envío del SMS con la información
del depósito ya que no me han avisado. #CODITO #2
"
"798","Realizar encuesta y visita en poblaciones alejadas de la ciudad, y reciban el
beneficio ya que son poco tomados en cuenta #SAN BERNARDINO #4
"
"799","Dispongan de asistencia jurídica vía telefónica, para que podamos ser orientados
de como sacar el nuevo permiso implementado #EL OASIS #2.
"
"800","Organizar talleres virtuales, para que los beneficiarios durante el proyecto se
capaciten y así se defiendan por sus medios #PORTAL SUR #2.
"
"801","No aprobar el beneficio hasta haber visitado el hogar de la persona, para no
facilitar la ayuda quien no la necesite # LIMONAR
"
"802","Que al firmar el contrato nos garanticen que recibiremos la confirmación del
depósito sea por SMS o llamada pero todos los meses #GAITANA #2
"
"803","Notificar vía SMS que ya está el dinero disponible, para acercarnos a retirar
con la seguridad de no perder el viaje. #CAROLINA #3
"
"804","Es muy buen servicio, pueden crear un link en el que las personas que no se han
visto beneficiadas puedan exponer su situación. #LISBOA #3
"
"805","Entregar videos recreativos para sacar el dinero del cajero ya que muchas veces
nos aturdimos cuando estamos en el banco. #SUBA RINCON #3
"
"806","Al recibir la ayuda monetaria sería bueno entregar mitad en dinero y la otra en
alimentos nutricionales. #SOPO GRATAMIRA #2
"
"807","Orientación Psicológica para salir de traumas por todo el tema de migración, DRC
podría ofrecer visitas en los barrios. #VILLA ESPERANZA #3
"
"808","Convenio con el banco para que mediante SMS nos informen el saldo disponible
para retirar, no siempre se retira todo el cash. #PERDOMO #3
"
"809","Que el lapso entre el registro y selección sea más corto, se logra colocando
personal adicional en el área de reclutamiento #SUBA BILBAO #2.
"
"810","Sería bueno que se pueda cambiar la contraseña para evitar riesgos, para ello
podrían enviar un video de orientación vía SMS. #VIVIANA #3
"
"811","Entidad en conjunto con ACH donde nos ayuden en información y procesos para
obtener la legalidad colombiana de mi familia #BUENOS AIRES #3.
"
"812","Capacitar con cursos sobre cómo podemos invertir el bono porque quiero generar
ingresos y compraré un carro de comida. #LUIS CARLOS GALÁN #3
"
"813","Sugiero permitir inscripciones de colombianos también en el programa porque
conozco muchos que también son vulnerables. #GAITANA #3
"
"814","Me gustaría que al finalizar el programa me puedan remitir a otra organización
de ayudas, tengo 5 niños que debo alimentar. #LA BALZA #2
"
"815","Considero importante que informen por SMS la disponibilidad del dinero, ya que
no estan las condiciones para salir a cada momento #TESORO #3
"
"816","Sólo creo que deberían estipular una fecha y fijarla para que cada mes sepamos
que desde ese día contamos con la ayuda. #LA PEPITA #2
"
"817","Visitar las veredas para las nuevas encuestas, ya que hay familias vulnerables
que necesitan de ayuda humanitaria. #VERGANZO #2
"
"818","Me hubiese gustado que me informaran de esta llamada ya que estamos muy
prevenidos al responder las preguntas. #FLORIDABLANCA #3
"
"819","A los beneficiarios que presentan síntomas de COVID-19, ayudarlos indicando a
donde acudir para realizarse la prueba gratuita #ROBLES #2
"
"820","Apoyar a los usuarios que necesitan ser operados con una parte de su costo,
podremos pagar el resto con el dinero del beneficio #ESPERANZA#4
"
"821","Brindar durante el tiempo de ayuda leche y pañales a madres solteras gestantes,
no me queda dinero, lo usa para pagar arriendo #CANTALEJO #3
"
"822","Visitar los hogares de los usuarios y brindar alimentos mensuales a los que
noten más desfavorecidos, muchos estamos sin empleo #BILBAO #3
"
"823","Creo que podrían investigar qué otras ONG están brindando apoyo en alimentación
actualmente para que nos lo indiquen en folletos #FAVORITA#3
"
"824","Aprobar el beneficio midiendo la necesidad de cada persona, mi hijo es
discapacitado, tiene 4 hijos pero no salió beneficiado #LOS ROBLES #4
"
"825","Ayudas de mercados cuando terminen el servicio pues los núcleos familiares están
conformados por niños y lo necesitamos. #SUBA #4
"
"826","Para mostrar un apoyo más cercano, podrían visitarnos en  nuestros hogares al
menos en una ocasión durante el tiempo de servicio #CEREZOS #4
"
"827","Por favor si van a cambiar la fecha de pago, notificar a través de SMS porque no
está llegando el pago en la fecha acordada. #SANTA LUCÍA #2
"
"828","Citar a reuniones 1 día antes de la consignación para que nos den charlas sobre
el buen uso y distribución del cash, eso ayudaría #LISBOA #5
"
"829","Enviar vía SMS información sobre cómo obtener el nuevo permiso migratorio a
todos los usuarios que lo necesiten, como en mi caso #LA ISLA #3
"
"830","Que envíen un SMS indicando que ha realizado la consignación, así vamos al
cajero solo cuando esté el dinero disponible #PANORAMA #3
"
"831","Recomiendo expandir éste programa por todas las ciudades del país y que también
tengan en cuenta más población colombiana. #MÁRTIRES #4
"
"832","Manejar diferentes componentes no solo el económico, hay jóvenes que requieren
ayuda psicológica y restablecimiento de derechos. #MIGUEL #2
"
"833","Lo ideal sería que puedan ser constantes cada mes y que envíen el SMS de
confirmación para no ir tantas veces a consultar saldo. #CHUCUA #5
"
"834","Convenir con una farmacia para que venda medicamentos más económicos a sus
usuarios, tengo que estar comprando anticonvulsivos #LOS REYES #5
"
"835","Por favor explicar bien al principio en la reunión cuál es el mínimo de personas
que se pueden incluir en el núcleo familiar #SAN VICENTE #3
"
"836","Me gustaría que citen a reunión presencial y expliquen más a detalle sobre esta
organización de dónde surgió y sus fundadores. #EL CARMEN #2
"
"837","Habilitar línea exclusiva para incluir familiares que no se encontraban al
momento de la caracterización, es el caso de mi hija #JARDÍN #3
"
"838","Solicitar al banco que aumente a 6 la cantidad de consultas gratuitas por mes,
para realizar los movimientos sin ningún temor #LOS ROBLES #3
"
"839","Efectuar convenio con una clínica que brinde atención pediátrica a hijos de las
usuarias, para que vean a mi hijo gratuitamente #FLORIDA #2
"
"840","Como complemento a la ayuda sería bueno que brinden cursos a los jóvenes para
ampliar nuestras oportunidades laborales. #GAITANA #2
"
"841","Es oportuno hacer una visita al hogar del participante antes de aprobar el
servicio, algunos son beneficiados sin necesitarlo #AURES II #3
"
"842","Instar al banco a que haga las mejoras necesarias a la página en la que se
consulta, pues pide usuario y clave pero no carga #BOSA #3
"
"843","Informar cuál será la fecha real del giro para evitar ir en vano al cajero
porque no está llegando en la fecha acordada. #ISLA DEL SOL #2
"
"844","Deseo que nos envíen video tutoriales cada mes sobre cómo realizar el retiro
correctamente, porque aún me parece confuso. #SANTA FÉ #2
"
"845","Permitir que la persona sea inscrita con la copia del documento si no posee el
original, para que pueda recibir el beneficio #CORINTO #3
"
"846","Apoyar los usuarios emprendedores con herramientas para que inicien un negocio,
necesito un calentador para vender empanadas #ESPERANZA #4
"
"847","Estimular a los usuarios a invertir el dinero en cosas necesarias, como la
alimentación y no lo malgasten como algunos hacen #VERBENAL #2
"
"848","Preguntar a los participantes en las reuniones si conocen otras familias que
necesiten ayuda, para que brindemos sus datos #VERBENAL #3
"
"849","Cuando llamen por primera vez, deben indicar de dónde obtuvieron la información
personal de la persona para generar confianza #SALITRE #5
"
"850","Implementar más programas como éste pero dirigidos a mujeres de mayor edad que
ya no tienen una fuente de ingresos fija. #MÁRTIRES #5
"
"851","A través de redes sociales publicar los anuncios sobre la realización de los
depósitos, estas; son un medio masivo efectivo. #CECILIA #2
"
"852","Antes de determinar el medio por el cual se recibirá la ayuda, llamar a
preguntar cuál de las opciones es viable para nosotros. #BILBAO #4
"
"853","Ayudar al usuario brindándole los elementos de trabajo que requiera para iniciar
un negocio, así progrese económicamente #RINCÓN DEL LAGO #4
"
"854","Realizar eventualmente reuniones con los usuarios en donde nos expliquen más
profundamente las funciones y servicios de  DRC #L. C. GALÁN #4
"
"855","Apoyar adicionalmente a los adultos mayores con alimentos mensuales durante el
tiempo de servicio, el dinero no nos alcanza #SAN ANTONIO #6
"
"856","Realizar las caracterizaciones de manera presencial en los barrios vulnerables,
para identificar las familias más desfavorecidas #S. PEDRO#3
"
"857","En la página oficial se habla de otros servicios; sugiero que en la charla nos
hablen acerca de todos los beneficios que brindan #DELICIAS#3
"
"858","Sería muy positivo que nos remitan a agencias de colocación de empleo, así
podríamos acceder a un empleo digno. #CHORRILLOS #4
"
"859","Incluir el servicio de apoyo psicológico e incorporar una línea en donde podamos
recibir esa atención, me siento en depresión #ESPERANZA #3
"
"860","Disponer de un medio por el cual nos den orientación a los jóvenes sobre
institutos para retomar los estudios. #CHORRILLOS #2
"
"861","Enviar SMS con link sobre diferentes temas referentes a la alimentación y
cuidado de la salud, aportarían a nuestros cuidado. #ZELANDIA #4
"
"862","Brindar talleres a los usuarios más jóvenes en oficios como panadería, para que
tengan más posibilidades de conseguir empleo #CAZUCA #2
"
"863","Brindar capacitaciones en las que nos enseñen a cómo invertir el dinero, para
establecer un negocio que nos proporcione ingresos #RINCÓN #3
"
"864","Que la cantidad de colombianos beneficiados sea proporcional a la de migrantes,
noté que seleccionan mayormente a venezolanos #LAS CRUCES #2
"
"865","Tener prioridad con personas de edad mayor y asignarles cita, tengo varias
comorbilidades y requiero atención médica #VILLA DEL DIAMANTE #5
"
"866","En la encuesta identificar si se cuenta con internet, de ser así; realizar
charlas mediante alguna APP, sería muy bueno. #SUBA RINCÓN #2
"
"867","Recomiendo enviar un SMS con la confirmación del depósito porque nunca voy en la
fecha indicada y debo esperar varios días. #BACHUÉ #2
"
"868","Me gustaría que complementaran la ayuda con un kit escolar para niños, el cash
lo utilizo para alimentación y pagar arriendo. #EL CARMEN #3
"
"869","Tratar de ser puntuales con la confirmación del depósito, porque me llega el SMS
días después de la fecha anunciada en reunión. #MÁRTIRES #5
"
"870","Habilitar línea telefónica en la que podamos solicitar el pago de 2 meses en 1
pero únicamente casos especiales, tuvimos Covid. #LISBOA #3
"
"871","Indagar bien antes de entregar la ayuda a través de visita domiciliaria para
verificar si verdaderamente necesita el beneficio. #EL OASIS #3
"
"872","Unir fuerzas con otra ONG del área de salud, para que recibamos asistencia
médica durante el tiempo del servicio #SABANAS DE TIBABUYE #3
"
"873","Habilitar un link que le permita a otras personas preinscribirse, para cuando
haya oportunidad evaluen su postulación a la ayuda. #PEDRO #3
"
"874","Gestionar un costo mas bajo en la consulta de saldo aunque no es mucho, sería
ideal que el dinero se pueda retirar todo. #CANTALEJO #4
"
"875","Sugiero no utilizar las entidades bancarias del grupo Aval, sería mejor realizar
la consignación por el Banco Agrario. #EDUARDO SANTOS #3
"
"876","Hacer un estudio previo de los costos de arriendo y alimentación de los
encuestados y en base a eso determinar el valor a asignar #LIJACA #2
"
"877","Pido a NRC que nos brinde cursos para aprender artes como costura, tengo una
máquina de coser, así podría trabajar en eso #CHORRILLO #2
"
"878","Crear una página web en donde podamos hacer consulta de saldo desde casa ya que
intente por la página del banco pero no funciona #IBARO I #3
"
