"","dataset[which(dataset$service_type == ""Cash Transfer""), ""feedback""]"
"176","No fueron seguido los pagos, llamaba y las líneas estaban fuera de servicio;
enviar SMS aclarando situaciones o imprevistos por parte de W.V
"
"177","Tener interacción con usuarios a través de llamadas constantes y personalizada
respecto al tiempo porque deje de recibirla a los 2 meses.
"
"178","Contar con más personal que atienda las líneas de contacto, solo recibí un pago
y tenía entendido que serían varios, nunca me contestaron
"
"179","Se deben tener más línea de atención para que podamos comunicarnos cuando
presentemos inconvenientes ya que lo he intentado varias veces
"
"180","Si existe algún retraso en al pago es importante llamar a los usuarios a
notificarlos, para así tener una alternativa mientras llega.
"
"181","Deseo que WV se contacte con los usuarios para clarificar el tiempo del cash, lo
recibí en junio y en agosto pero ya no, estoy confundido
"
"182","Debido a un retraso en la entrega del Pin tuve que pagar una cuota extra de
arriendo, sugiero que puedan llamarnos con tiempo cuando suceda.
"
"183","El programa podría modificarse con cursos en peluquería para certificarme y
trabajar, mi cash termino y ahora mi necesidad es peor
"
"184","Preguntar siempre que es más conveniente para cada usuario, adelantar o no el
pago, el beneficio termino muy rápido y ahora no se que hacer
"
"185","Continuar con un acompañamiento para los bebés con pañales, medicinas y leche el
cash era para mí hijo y ahora no se que hacer
"
"186","Deseo que NRC alargará por más tiempo este beneficio, porque sufrí una quemadura
y con está discapacidad no tengo como alimentar a mis hijos
"
"187","El programa debe enfocarse en madres gestantes y madres solteras para alargar el
beneficio por más tiempo, tengo 4 hijos y no tengo ayuda
"
"188","Notificar mediante un SMS o correo electrónico cuando realizan cambios en las
entregas del dinero ya que contaba con ello mensualmente.
"
"189","No sé si mi ayuda ya terminó, me gustaría que NRC pudiera llamar a todo aquellos
que ya finalizan el servicio y evitar dudas sobre esto
"
"190","Sugiero habilitar una línea telefónica para que los usuarios que tengamos
inconvenientes podamos resolver los casos y estar más satisfechos.
"
"191","Sugiero que deben tener más personas contestando las llamadas o los correos que
nosotros podamos enviar, por lo demás el servicio está bien
"
"192","Me gustaría que NRC nos avisará mediante SMS la fecha y el monto del dinero para
ir a retirar más seguros y no perder la ida al cajero.
"
"193","Contar con más líneas telefónicas para que podamos obtener respuesta ya que
quisiera saber hasta cuándo dura mi beneficio actualmente.
"
"194","Mi sugerencia sería que nos preguntarán como quisiéramos recibir el dinero ya
que me servía mensual durante los 6 meses para el arriendo.
"
"195","Me hubiera gustado que los niños recibieran atención médica en el tiempo que
duró la ayuda, el dinero no alcanza, y lo usaba en arriendo.
"
"196","Monitorear más a menudo la entrega del dinero a los beneficiarios ya que algunos
hacen mal uso del dinero como en bebidas alcohólicas.
"
"197","Notificar vía SMS si existen atrasos en el pago, no he recibido mi consignación
del mes de agosto y temo ser desalojada, necesito ayuda
"
"198","Pienso que debio durar más la ayuda porque la usaba para arriendo, mi opinión es
que compartan los datos de nosotros a otras ayudas.
"
"199","Para estar más pendientes de los usuarios sería muy bueno que NRC realicé
llamadas y charlas de conciencia sobre los cuidados del covid-19.
"
"200","Aceptar proyectos de emprendimiento para Dar las herramientas según la idea,
para que los migrantes no crean que todo es regalado.
"
"201","Por favor dar la ayuda por 2 meses más mientras la crisis pasa, tengo 2 hijas
con discapacidad, me van a desalojar y estoy desesperada
"
"202","En las encuestas tener en cuenta el nivel económico y las condiciones de salud
para así mismo dar la cantidad de dinero y ayudar más.
"
"203","Pido que tengan más comunicación con nosotros y una línea a la cual podamos
llamar y que nos contesten cuando tengamos alguna duda.
"
"204","Considero que deben tener dos correos alternativos para que puedan responder
nuestras solicitudes a tiempo, uso el Cash en comida y arriendo
"
"205","A veces no contestan los números telefónicos por ello es bueno que NRC envíe SMS
explicando el motivo para no estar intranquilos y esperar.
"
"206","Me hubiese gustado que el cash durará más tiempo, es mejor no adelantar la ayuda
ya que son menos meses para acomodarse.
"
"207","Incluir más personal que responda correos enviados hacia asesoría jurídica, así
atender todas las solicitudes. Pago habitación con el cash.
"
"208","Al finalizar esta ayuda brindar una bolsa de alimentos, kits de aseo, ya que es
con lo único que contaba para comprar alimentos o arriendo.
"
"209","Organizar los cronogramas de entrega de ayudas así no estaría confundida si voy
a recibir el cash, lo que recibo lo uso en alimentos.
"
"210","Preferiría que me llamaran antes de los depósitos y así saber y tener certeza de
salir a la calle a retirar la ayuda.
"
"211","Me ha ayudado mucho para pagar donde vivir pero no me alcanza para la comida,
sugiero que al final nos puedan brindar un bono en alimentos.
"
"212","Estoy delicada de salud, pero no me atienden por estar de forma irregular. Pido
me den información de una ONG en salud que me pueda ayudar.
"
"213","Tengo temor de finalizar el beneficio ya que esté es el único ingreso, NRC pueda
orientarnos a recibir más ayudas como alimentaria o higiene
"
"214","Recibir llamada de NRC para cuando realicen actualizaciones o alguna novedad
como adelanto del dinero ya que aveces me siento confundida.
"
"215","El tiempo en responder si seremos beneficiarios en el servicio sea más corto ya
que me inscribí en enero y hasta junio fui seleccionada.
"
"216","Habilitar una línea de atención para resolver dudas, me llegó un SMS de
culminación del beneficio y no he podido comunicarme para aclarar
"
"217","Crear una línea de atención psicológica para buscar ayuda y orientación ante
situaciones de abuso, pasamos situaciones difíciles
"
"218","Incluir como cabeza de hogar a quien tenga más familiares directos inscritos,
estoy con mis 2 hijas pero quien nos representa es mi hermano.
"
"219","Estoy inscrita hace tiempo pero no me han informado de pagos, no se si me
depositarán o no. Pido que haya más comunicación con los usuarios.
"
"220","Verificar los meses consignados y así mismo enviar el mensaje de terminación,
porqué me llegó este SMS y solo he recibido 3 pagos
"
"221","Sugiero que NRC me realice una llamada aclaratoria ya que en mi caso solo recibí
3 transacciones de 220.000 pesos cada una y tengo dudas.
"
"222","Crear un protocolo de pasos a seguir ante un robo o perdida de la tarjeta para
que sepamos que hacer, hace 2 meses no he podido retirar
"
"223","Falta más comunicación entre NRC y sus usuarios para informar cambios,
modificaciones e implementos nuevos que debemos saber. Deben llamar.
"
"224","Llamar a las personas que no han retirado por meses para saber que paso, ya que
se me perdió la tarjeta y fue imposible comunicarme con NRC
"
"225","Podrían ayudarnos con cartas de salvoconducto que puedan certificar la ayuda,
las autoridades nos dicen que éste no sirve y nos deportarán.
"
"226","Para aquellos usuarios con problemas críticos de salud junto al beneficio
brindar un incentivo puede ser monetario o de implementos médicos.
"
"227","No me han hecho el último depósito, quisiera que me llamaran para que me
informen la razón por la cual no lo realizaron.
"
"228","Realizar una llamada de cierre para agradecerles a NRC y también preguntar si
existirán más proyectos futuro y como acceder a ellos
"
"229","Tener un a línea de atención telefónica porque el pago de mayo no ha llegado no
se porque y debo mudarme por el bienestar de mis hijas
"
"230","Dividir los usuarios y asignar un coordinador para postular dudas acerca del
cash, me siento confundido con los adelantos y no se que hacer
"
"231","Un SMS para notificar que el dinero ya se encuentra en el cajero e ir al cajero
sin ningún inconveniente y con tranquilidad
"
"232","Me gustaría que NRC tuvieras varias líneas de atención telefónica, mi beneficio
pronto culminará y no se el saldo exacto a retirar
"
"233","Pienso que podrían tener una persona colaborando en la atención a los usuarios
ya que intento llamar y escribir y aún no me han respondido
"
"234","De acuerdo a la composición del núcleo familiar donde hayan niños menores de
edad o embarazadas aumentar el montón del dinero por la crisis.
"
"235","Mi único sustento es el que ustedes me dan. Ya casi termina la ayuda. Pido que
al finalizar este apoyo, me indiquen donde podre pedir ayuda.
"
"236","Al entregar la tarjeta darnos un login para ingresar a la página del
banco,verificar saldo y consignación,porque la página no funciona
"
"237","Considero que para evitar inconformidades y pérdida de información, por parte de
NRC nos llamen para explicar los pasos a recolectar el Cash
"
"238","Líneas telefónicas para que nos llamen a preguntar sobre le beneficio ya que el
dinero me llegó incompleto y necesito resuelvan mis dudas.
"
"239","Mi hermana tuvo un problema con su pago y no ha podido comunicarse y desearía
que haya un link donde podamos explicar estas situaciones.
"
"240","Que NRC cree un login para ingresar a la página del banco y así verificar los
movimientos y saber si tengo dinero en mi cuenta
"
"241","Se que es difícil Pero si NRC alargará el tiempo del beneficio o brindará más
dinero yo podría cubrir el arriendo y alimento en la crisis
"
"242","Nunca contestan el whatsapp que dieron el día de la entrega de la tarjeta.
Pueden habilitar una línea de mensajería para resolver dudas
"
"243","Tener un contacto más cercano a NRC por medio de un grupo de WhatsApp,para
preguntar acerca del cash y notificar novedades que nos sucedan
"
"244","Crear un protocolo para la perdida de la tarjeta y darlo a conocer en la 1ra
charla,para saber que hacer en este caso y actuar rápido
"
"245","La ayuda es muy buena. Pero lo que realmente necesitamos es trabajar para
depender de nuestro trabajo y no de las ayudas que nos dan.
"
"246","La ayuda es n
"
"247","Mi esposa y yo somos diabéticos y lo que percibimos de su parte lo gastamos en
medicina, me gustaría recibir algo más para comprar comida.
"
"248","Que NRC done cash a mis familiares que están en Venezuela,es decir contactarlos
y caracterizarlos desde aquí porque están necesitados
"
"249","Sufro de diabetes y también de tiroides. Lo que nos depositas lo gastamos en
medicina. Podrían ayudarnos adicionalmente para el arriendo.
"
"250","Tengo prostatitis aguda y para mí sería beneficioso que NRC tuviera convenios
con IPS para tener un tratamiento con la medicina Erogan
"
"251","Tengo 6 meses de embarazo y en mi casa estamos aguantando hambre porque el
dinero lo pagamos en el alquiler. Por favor apoyenos con comida.
"
"252","Ya vamos a finalizar el período del beneficio y no sabemos Qué hacer si la
cuarentena sigue Ojalá NRC pueda extendernos un mes más
"
"253","Lo que me depositan me alcanza apenas para pagar arriendo, tengo una bebé.
Pediría una ayuda especial para comprar los casas de la bebé.
"
"254","Tengo una bebé de 2 meses de edad me gustaría tener la oportunidad de que NRC
nos de un mes de Gracia Después de terminar el beneficio
"
"255","Seguir adelantando el pago ya que ésto nos alcanza solo para pagar los
hospedajes o arriendos y poco o nada nos queda para la alimentación
"
"256","Yo vendo bolsas y me tengo que exponer en la calle al virus y a la policía, de
verdad necesito la ayuda. Pido que al final me la renueven.
"
"257","No idea
"
"258","Debido a esta cuarentena nos gustaría que aumentaran un poco el saldo y que al
finalizar vuelva a de nuevo a la normalidad
"
"259","Me siento muy agradecida pero estoy preocupada porque el cash terminará deseo
que por favor se alargue es el unico sustento para mí familia
"
"260","Que puedan hacer una alianza con otras organizaciones para recibir mercados o
alimentos debido a que el dinero que usamos es para arriendo
"
"261","Podrían implementar por más tiempo el beneficio o apoyo con alimento porque mi
hijo no puede trabajar y tengo un bebé que necesita alimento
"
"262","Quisiera que el beneficio se ampliará por más tiempo y más cantidad porque está
situación está muy fuerte y dónde vivo me quieren desalojar
"
"263","Hay un número de WhatsApp al que escribimos pero nunca nos responden Queremos
saber si el mes que se adelantó es el último o no
"
"264","Por un número errado cancelaron mi beneficio,deseo que si no contestamos,se
comuniquen por correo electrónico,porque me desalojarán pronto
"
"265","Que nos puedan ayudar con algún otro servicio como el de alimentación pues se
nos ha hecho difícil debido a la cuarentena
"
"266","Que las ayudas las den quincenal en vez de mensual, ya que podríamos percibir
dinero mas seguido y así nos podrá alcanzar para lo necesario.
"
"267","Puedo recibir información de los saldos que nos quedan o meses Por recibir el
beneficio ya que sabremos y nos organizaremos
"
"268","En estos momentos el dinero lo usamos para poder pagar arriendo pero no tenemos
alimentos ojalá pudiesen hacer algo para ayudarnos
"
"269","Quisiera que NRC pudiera hacer convenios para poder recibir otro tipos de
servicios como de alimentación para poder solventar esta crisis
"
"270","Deseo que nos brinden más dinero por más tiempo porque tengo temor de no tener
ingresos y tener que regresar a Venezuela con mi hija
"
"271","Que se pudiera generar una inversión en mercados para poder alimentar nuestras
familias,  ya que el dinero solo alcanza para pagar arriendo.
"
"272","Qué otras organizaciones pueden hacer alianzas con NRC para poder recibir otro
tipo de ayudas como alimentos qué es lo que más necesitamos
"
"273","Necesitamos que nos ayuden con otro tipo de servicios en este momento como
alimentación ya que debido a la situación no tenemos
"
"274","Tengo prostatitis aguda y requiero del medicamento """"erogan"""". Quisiera que me
ayudaran con el medicamento o un dinero extra para comprarlo.
"
"275","Mi bebé presenta problemas de déficit nutricional, yo agradecería que me
ayudaran con algo de medicamento o un dinero extra para comprarlo
"
"276","Que hagan sociedad con alguna eps para que quienes poseemos la tarjeta
disfrutemos de sus servicios de salud. Ya que aquí no nos atienden.
"
"277","Ampliar la cantidad y el tiempo,porqué mi arriendo es caro y debo juntar 2 meses
de cash para pagar 1 mes de arriendo,me preocupa mi familia
"
"278","La información de los adelantos de los meses me hubiese gustado recibirla por
algún medio que pueda darme a conocer la noticia, sería bueno
"
"279","Como no podemos salir frecuentemente me gustaría recibir mi depósito por medio
de una transferencia a mi dispositivo móvil
"
"280","Mi esposo murió hace 20 días y estoy sola con mis tres hijos, podrían renovar mi
ayuda cuando termine. Ya me quedan pocos meses.
"
"281","Mi mamá tiene un quiste en una axila y se le inflama hasta el pecho, yo pienso
que  ayuda extra a personas con condiciones médicas.
"
"282","Quisiera poder recibir el monto ya se como lo han estado haciendo o por otro
medio pero que con SMS pueda saber que ya está allí
"
"283","Nunca me ha llegado información de saldos o información a cerca del beneficio,
me gustaría recibirla y estar informada
"
"284","Apoyo con alimento,porqué me despidieron del trabajo por la crisis,mi esposa
está embarazada y tengo una bebé ellas necesitan buen alimento
"
"285","Que los bancos no cobren comisión al momento de retirar dinero o realizar pago
con la tarjeta porque realmente cada pesito lo necesitamos.
"
"286","Que no prolonguen la ayuda por unos meses más porque esta pandemia nos esta
dejando muchas deudas.
"
"287","Que evaluaran cada caso de los beneficiarios para poder dar un poco más de ayuda
a quienes más lo necesitamos.
"
"288","Que se asiganara una pequeña parte del dinero que nos dan para pagar un seguro y
así nos puedan atender en algún centro médico.
"
"289","Yo diría que nos dieran un bono especial por el periodo de cuarentena,  es que
la situación está mucho más complicada estos días.
"
"290","Estoy feliz por el beneficio pero debido a la pandemia sería bueno prolongarán
el tiempo de la ayuda del dinero ya que estamos sin trabajo.
"
"291","Que NRC ojalá hiciera convenios con organismos para crear albergues o
campamentos y este dinero sirva como pago del sueldo al construirla
"
"292","Que se extiendan 6 meses más la ayuda económica a las familias más necesitadas
para pagar las deudas que nos esta generando esta crisis.
"
"293","Disminuir los meses de entrega del beneficio para captar más efectivo y así
cubrir las necesidades mientras se consigue un trabajo estable
"
"294","Ojalá pudiera usarla también en tiendas con datáfono y no necesariamente en
cadenas de supermercado, con el fin de evitar más costos
"
"295","Un préstamo o microcrédito con reembolso de la suma total, ésto para incentivar
la creación de trabajos independientes para los documentados
"
"296","Que puedan poner en marcha de nuevo este servicio para las personas ya
registradas y que no les ha llegado, para que se beneficien también
"
"297","Que me siguieran entregando la ayuda si la cuarentena se extiende hasta después
de Julio ya que es la fecha para mi último depósito.
"
"298","Que en vez de dar la ayuda 6 meses, se nos de el dinero en un solo depósito para
poder comprar un buen mercado y soportar la cuarentena.
"
"299","Aumentar el monto a mujeres embarazadas solteras pues para ellas la situación es
más difícil, o que para ellas haya un tiempo extra
"
"300","Que nos dieran ese dinero por más tiempo, que dure 10 meses al menos, ya que
esta cuarentena nos tiene endeudados y no tenemos para pagar.
"
"301","De verdad que este aislamiento a empeorado  nuestra calidad de vida, por eso es
necesario que nos ayuden unos meses más y no solo 6 meses.
"
"302","Me he sentido abandonado en esta cuarentena y le pido a nrc que nos colabore con
alimentos durante 2 meses,somos 4 y vivimos en los mártires
"
"303","El monto recibido no nos alcanzan para muchas cosas,podrian implementar un
servicio de salud ya que tengo un mioma y sangro constantemente.
"
"304","Alargar el beneficio por 2 meses más,porque este apoyo me cubre un poco las
necesidades y sin el no tendría ningún ingreso,tengo 3 niñas
"
"305","Unos bonos especiales dirigidos a personas con mayor necesidad, ya que los más
vulnerables estamos siendo muy afectados por el aislamiento.
"
"306","Que nos pudieran ofrecer algunas ofertas en alimentos de la cesta básica en
algunos supermercados a quienes paguemos con la tarjeta
"
"307","Un monto especial para madres solteras con hijos pequeños. Tengo un bebé de 18
meses y lo que me dan no me alcanza para comprar sus cosas.
"
"308","Que aparte del dinero nos apoyaran con un mercado ya que el dinero lo gastamos
todo en arriendo y no nos queda para comprar comida.
"
"309","Yo creo que si aumentaran el monto de ayuda sería mucho mejor porque de verdad
que no alcanza ya que no podemos trabajar por la cuarentena.
"
"310","Estoy agradecida pero el dinero no me alcanza,si brindarán alimento destinaría
el cash al arriendo porqué me preocupa que me desalojen
"
"311","Organizaciones que apoyen el aprendizaje para que puedan brindar cursos
gratuitos y así las personas aprovechen y mejoren su hoja de vida.
"
"312","Me siento bendecida con la ayuda, pero si deberían tener más información para
que la gente la use.
"
"313","Que le suban la tarifa ya que la cuarentena ya que  no podemos trabajar y nos
estamos viendo cortos para los alimentos sería bueno.
"
"314","Muy agradecido con la ayuda, ojalá fuera cada 15 días , mientras esté la crisis
nos veremos con mas necesidad.
"
"315","apoyarnos con un mercado sustancioso estoy desesperada por alimentar a mi bebé
de 2 años y el cash transfer se me acaba en mayo.
"
"316","B Nueva Zelanda,  4 personas:  sugiero que me ayuden con alimentos ya que no
trabajo  por la pandemia.
"
"317","El apoyo fue muy bueno con esto me he podido sostener, yo diría que debería ser
más dinero ya que es mensual.
"
"318","Soy madre de dos niños y sólo yo aportó a mi hogar, Qué posibilidades hay que la
NRC aumente el monto, sólo por este momento de crisis
"
"319","B Villa Gladis. Que me brinden una ayuda de alimentos para mis 2 hijos son
menores edad, actualmente no trabajo por el virus.
"
"320","Todo es muy bueno si se pudiera alargar el tiempo que fuera por un año sería de
gran ayuda para mi familia.
"
"321","Poder usar la tarjeta en donde sea posible ya que sería bueno comprar las
promociones de alimentos y llevar más a la casa.
"
"322","Quisiera recibir capacitación de cómo usar esta tarjeta o como implementarla
para crear mi propio negocio pues es difícil conseguir trabajo
"
"323","Alargar las fechas  por un año ya que la cuarentena cada día es más crítica y mi
familia nesecita comer.
"
"324","Beneficio de salud tengo a mi esposo enfermo y necesita de medicamentos y el
cash tranfer lo utilizo para el sustento en alimentos.
"
"325","Subir monto de cash tranfer ya que no me alcanzo para comprar alimentos y tengos
niños que requieren de una buena alimentacion.
"
"326","La ayuda de CRC es muy buena, pero si nos llamarán más para darla más seguido
sería de gran ayuda en estos momentos.
"
"327","Quisiera usar esta tarjeta en citas generales, en clínicas autorizadas o donde
lo necesite, para mi hija que debe ser valorada medicamente
"
"328","Que aumenten el incentivo, porque somos 4 personas y no nos alcanza para merca y
además no estamos trabajando.
"
"329","Un método más fácil para hacer consulta de la consignación del dinero,se puede
realizar por medio de un correo pero aveces no se entiende.
"
"330","Algunas personas no están seguras de la consignación del dinero,sería bueno
avisarán por medio de un MSJ y así no pierdan la ida al retirar.
"
"331","Deberían estudiar cada caso para que sea mayor la ayuda económica a quienes
necesitan apoyo médico. Como mi esposa que requiere operación.
"
"332","Subir monto ya que por esta crisis es imposible salir a trabajar y el cash
tranfer no me alcanzo para el arriendo.
"
"333","Que dieran un monto de dinero exclusivo para la compra de mercado aparte del que
ya dan, ya que ese nos alcanza apenas para arriendo.
"
"334","Me gustaría que los depósitos sean a principio de mes y no al final. Porque el
pago de los servicios y alquiler son al principio de mes.
"
"335","En este momento es muy buena la ayuda recibida, quisiera que nos capacitaran a
las mujeres cabeza de hogar en emprendimiento.
"
"336","Ojalá pudieran hacer visitas a los beneficiarios para que puedan conocer y ver
cómo se utiliza y De qué manera la tarjeta de dinero
"
"337","Quisiera tener la oportunidad de recibir estos pagos No en 6 meses si no en con
3 con el fin de tener un poco más para la comida de mi bebé
"
"338","Consideró que el monto debiera ser fraccionado en dos meses pues tendríamos un
poco más para el arriendo y la comida, esto sería muy útil
"
"339","Cada vez que consultó en el cajero automático pierdo una transacción, me
gustaría recibir información a mi celular respecto a esto.
"
"340","Soy de la 3ra edad y creo que la caracterización no fue la adecuada, propongo
que  se adelante el pago por  esta situación de cuarentena.
"
"341","Mediante un mensaje de texto pueda ver el estado de cuenta cada vez que compre o
use la tarjeta, y así saber claramente cuanto me queda allí
"
"342","Que puedan realizar censos más seguidos y continuar así, para que los que no han
podido acceder a este servicio reciban el beneficio.
"
"343","Ojalá pudiéramos tener la opción de recibir solo 2 pagos y no 6 pues ésto nos
ayudaría y tendríamos un poco más para hospedaje y comida
"
"344","Brindar las herramientas para un emprendimiento,en mi caso un carro de comidas
para no depender del beneficio y tener ingresos propios
"
"345","Por esta contingencia podrían dar más dinero o un complemento con alimentos
estamos preocupados al no tener como trabajar por el virus
"
"346","Tener la posibilidad de dividir ésto en solo la mitad de los meses de beneficio
con el fin de que tengamos un poco más para asentamiento
"
"347","Adelantar todo el saldo restante por qué teniendo todo el dinero podremos
sustentarnos por los menos por los 2 meses de cuarentena
"
"348","Crear un plan de contingencia para la madres con varios hijos,brindarles
alimento y pañales ya que no podemos trabajar por el virus
"
"349","Retire el dinero pero el monto fue menor al que pensaba, me gustaría tener
acceso por un mensaje al estado de cuenta de la tarjeta siempre
"
"350","Prioricen esta ayuda a familias con niños y 3ra edad realizando visitas, muchos
no necesitan esta ayuda y son los que más  se aprovechan.
"
"351","Microcréditos para iniciar un proyecto productivo,porqué a pesar de que este
servicio es muy bueno,este se acabará y mi necesidad va seguir
"
"352","A mi parecer la ayuda es muy poco y para contrarrestar esto deberían dar también
implementos de aseo para los niños porque no nos alcanza
"
"353","el monto que me llega no me alcanza para mucho y  propongo que con la tarjeta
nos brinden alimentos, ya que es lo más costoso.
"
"354","Que en la caracterización a las mujeres embarazadas contaran su bebé como un
integrante del núcleo familiar, en mi caso no fue incluido.
"
"355","Me llegó un poco menos del dinero acordado, y para evitar confusiones y
descuentos pueden enviarnos un mensaje de texto especificando todo.
"
