"","dataset[which(dataset$service_type == ""Cash Transfer""), ""feedback""]"
"356","Sería positivo que junto con el dinero nos brindarán alimento por qué no alcanzo
a cubrir todas la necesidades de mi familia
"
"357","Microcréditos para emprendimientos para las personas de la 3ra edad por qué
teniendo un ingreso independiente no sería una carga para nadie
"
"358","Capacitaciones de cómo distribuir el dinero a lo largo del mes,porqué así sabría
que porcentaje debo destinar para el arriendo y al alimento
"
"359","Ampliar las visualizaciones de saldo a + de 3,porqué me descontaron dinero al ir
al cajero varias veces por desconocer la fecha de entrega
"
"360","Considero que el monto recibido no fue el apropiado y me gustaría que se
aumentara la cantidad de este ya que  somos 8 personas en mi casa
"
"361","Implementar medicinas en NRC para que personas con ciertas enfermedades,tengamos
medicamentos y destinar el cash a otra necesidad
"
"362","Al citarnos al seguimiento infórmanos cambios si existen,por qué a la fecha no
he podido retirar y no sé si ya no tengo este beneficio
"
"363","Informarme por medio de notificaciones si realizarán cambios en la fecha de
entrega,por qué hasta el momento no podido retirar
"
"364","Si llegan a cambiar la fecha por favor notifiquen por llamada y con antelación
para saber cómo organizar los gastos mensuales
"
"365","Visitas domiciliarias para evidenciar las condiciones en las que vivo y ampliar
el tiempo de este beneficio por qué estoy muy necesitado
"
"366","Visitas a los beneficiarios,dónde evidencien  las condiciones y cantidad de
niños y así tomar la decisión de continuar o no con el cash
"
"367","Alimentos y kits de aseo para bebés con pañales,crema y pañitos para destinar el
cash en el arriendo por qué soy madre soltera
"
"368","Si cambian la fecha de entrega,por favor asegurarse que el dinero llegué en la
nueva fecha por qué me siento preocupada al no poder retirar
"
"369","Notificar por mensaje texto o vía correo electrónico la consignación del dinero
para no preocuparme si el pago llegó o no
"
"370","Se debe preveer que uno cuenta con el dinero en una fecha fija,mi hija estuvo
hospitalizada y al tener este dinero no la pude retirar
"
"371","Bonos de alimentos y ropa junto con el cash para que nuestras cargas sean más
livianas y destinar el dinero al arriendo y servicios
"
"372","Notificarme al celular si ya fue realizado el pago para dirigirme de una vez al
cajero sin ninguna incertidumbre
"
"373","Mantener la fecha fija o si es posible realizar la consignación cada 15 días por
a fin de mes nos vemos cortos
"
"374","Pautar un fecha fija del cash,porqué así puedo organizar los recursos del mes y
cumplir con el arriendo y las demás obligaciones
"
"375","Tener una fecha fija para retirar el dinero por que me he comprometido a pagar
el arriendo en cierta fecha y me atraso por los cambios
"
"376","El monto de dinero debería ser mayor como (500.000) mensual, ya que el nivel de
vida en Bogotá es costosa y debería ser proporcional
"
"377","Mensualmente recibo 120.000 y desearía 200.000 para poder sobrellevar las
obligaciones del hogar, mis ingresos no alcanzan.
"
"378","Quisiera que el apoyo económico subiera a $300.000 por qué este nuevo año
aumento mi arriendo y la comida y no me alcanza para subsistir
"
"379","Deseo que la consignación del  subsidio sean cada 15 días ya que mensualmente se
nos dificulta distribuir bien el dinero.
"
"380","Nuestra familia es de 6 y el dinero no me alcanza mucho, me gustaría que se
incentive económicamente los  proyecto de emprendimiento.
"
"381","Que realicen una visita que determine nuestra condición  y cuántas personas
somos para así aumentar el valor de la ayuda, estamos muy mal
"
"382","El pago no me llegó completo y por ende no me alcanzó para cubrir muchos gastos
que tengo, me gustaría mayor control sobre el pago mensual.
"
"383","Si fuese yo aumentaría el monto del subsidio ya que me encuentro sin empleo y 
no me alcanza para mucho, ni para alimentación.
"
"384","Me agradaría que se hicieran unos ajustes aumentando el saldo de la tarjeta ya
que esta cantidad no es suficiente y todo es muy costoso
"
"385","Todo en este cambio de año subió todo  y sin empleo ni modo, y por eso sería
positivo que este también subiera su valor monetario.
"
"386","Mi familia es muy numerosa y quisiera que el monto de dinero lo dieran según la
cantidad de personas en la casa ya que es muy poca plata
"
"387","Sería necesario que se cree un comité de la misma comunidad que puedan
identificar la vulnerabilidad y ayudar a que tengan este apoyo.
"
"388","No quiero ser desagradecida, pero me gustaría que el monto fuera mayor debido a
que mi núcleo familiar es muy grande y estamos muy mal
"
"389","Sería un gran aporte más de dinero,por qué tengo una hija con discapacidad
cognitiva y los recursos no me alcanzan para costear su salud
"
"390","Me desalojaron y tendré que dormir en la calle con mis hijos, quisiera que
aumentaran la cantidad de dinero para pagar una habitación.
"
"391","Mi idea es implementar notificaciones en mi celular la cuáles me avisen del pago
en la tarjeta y así saber cuándo puedo retirar mi dinero
"
"392","Mi idea es que la cantidad de dinero se pueda aumentar en aproximadamente
200.000 pesos más ya que no contamos con una estabilidad
"
"393","Me encuentro en condición de calle y en este momento no alcanzo a costear mi
sustento,es por esto que sería grandioso un poco más de dinero
"
"394","Pero no han hecho la entrega del dinero este mes, mi idea es que sean puntuales
ya que necesito comprar zapatos y útiles escolares
"
"395","Creo que el dinero no me llegó completo y mi idea es que la información de la
entrega y el monto sea más especifica Para no generar dudas
"
"396","Si no es posible ampliar la cantidad de dinero, me gustaría que otro miembro de
mi núcleo pudiera tener este beneficio y así estabilizarnos
"
"397","Es importante que la cantidad fuera más alta ya que tengo una bb de 7 meses, me
encuentro desempleada y esto mejoraría mi calidad de vida.
"
"398","Tengo una bebé de 7 meses y muchos gastos y considero que el monto es muy poco,
mi idea es que el monto sea mayor porque no tenemos empleo.
"
"399","La cantidad que nos dieron es muy poca ya que  no nos alcanza para ganar ni una
habitación. Seria positivo que fuera mayor cantidad
"
"400","Esperaba que el dinero fuese más cantidad, y me enfoco en que se logre subir el
monto ya que trabajo en la informalidad y no me alcanza
"
