"","dataset[which(dataset$service_type == ""Healthcare""), ""feedback""]"
"188","Poder contar con especialistas como pediatría, odontología, ortopedia,
oftalmología y imágenes diagnósticas para tener un mejor servicio.
"
"189","Poner un servicio de farmacia dónde la persona que entregué los medicamentos nos
informe la manera correcta de tomarlo.
"
"190","Que las organizaciones aporten más dinero a la cruz roja,para recibir más ayudas
ya que muchos no contamos con ellas.
"
"191","Pondría un servicio de urgencias las 24 horas ya que es el único sitio qué nos
está prestando él servicio.
"
"192","Que implentararan más especialistas como pediatría y ginecología ya que hay
muchas gestantes que no pueden tener sus controles completos.
"
"193","Salí del consultorio y me parece quedeberían tener los implementos adecuados
para una consulta cómo el biombo y guantes.
"
"194","Creo que los médicos necesitan una auxiliar de enfermería, para que los asistan
ya que hay muchos pacientes que requieren atención especial.
"
"195","Más personal en recepción eso nos ayudaría a que la atención sea más rápida.
"
"196","Me parece que la atención prestada es muy buena pero falta implementar,más
consultoríos   médicos.
"
"197","Pondría 3 consultorios de odontología,ya que es fundamental tener ese servicio
de los niños y adultos.
"
"198","Si nos dieran un permiso para trabajar,no habríamos tantos migrantes mendigando
en las calles para comer.
"
"199","La veces que he venido he visto que la recepción es muy pequeña y no tenemos el
espacio adecuado para todos los que llegamos yo la agrandari
"
"200","Insumos para los consultorios médicos como guantes, biombo ya que es
indispensable para nuestra privacidad.
"
"201","Que haya una sala de triage para que así le den prioridad a los niños y adultos
mayores y no tener que esperar mucho la atención médica.
"
"202","Deberían ampliar la recepción, dónde puedan poner más sillas muchos nos toca
esperar de pie o afuera y obstaculizamos el paso.
"
"203","En los consultorios médicos veo que no hay un biombo y es muy importante porque
para la privacidad del paciente.
"
"204","Agrandaria la sala de espera,muchas veces nos toca esperar en la calle o parados
por el espacio estrecho.
"
"205","Sería bueno que hubiera más baños y no fueran mixtos por higiene.
"
"206","Deberían poner un servicio de urgencias las 24 horas así nos facilitaria el día
de hoy tener un servicio médico.
"
"207","Crear más puntos de atención de la cruz roja en diferentes comunas ya que dinero
para desplazarnos siempre a las citas médicas.
"
"208","Deberían implentrar una farmacia dónde un farmacéutico le entregué el
medicamento a uno me sentiría más segura.
"
"209","Yo diría que falta consultorio donde puedan atender una emergencia que haya
oxígeno, reanimador y un equipo de curaciones básicas.
"
"210","Es muy importante que tengan un ginecólogo en la sede porque hay muchas
gestantes sin control ni atención en los hospitales.
"
"211","Destinataria más dinero a cruz roja para que puedan seguir dando las ayudas
económicas,ya que muchos que nos quedamos sin la ayuda.
"
"212","Deberían implentrar una brigada continúa, así el día de hoy podríamos recibir
algún servicio médico o de ayuda económica.
"
"213","Tener como 5 médicos generales así la atención sería continua y no tendríamos
que esperar por el servicio hasta el otro año.
"
"214","Que para las próximas brigadas de salud,se pudieran implementar más servicios
como odontología, pediatría para tener un servio más completo.
"
"215","Sería bueno que las brigadas de salud fueran más las largas, hoy vine y nos
dicen que no saben cuándo hay servicio.
"
"216","Espero que el servicio médico se normalice para poder traer a mis hijos para
continuar con los tratamientos médicos.
"
"217","Yo pondría un consultorio de inyectologia,he visto que no hay privacidad.
"
"218","Importante que en la entrada encontremos una recepción,el espacio donde me
reciben es muy pequeño y no hay sillas .
"
"219","Mi idea es que la cruz roja nos siga llamando para las ayudas económicas, ya que
a sido de gran ayuda.
"
"220","Un consultorio de enfermería donde tengan una camilla para poner las inyecciones
y que sea una jefe enfermera la que ordena los medicamentos
"
"221","Implementar más servicios de especialistas en
odontología,oftalmología,ginecología,pediatras mis hijos necesitan de estos.
"
"222","Incrementar las ayudas y recursos para la cruz roja,ya que hay muchos migrantes
sin poder acceder a las ayudas y albergues.
"
"223","Crear una ludoteca para los niños para cuando los padres están en talleres o
citas medicas ellos estén aprendiendo.
"
"224","Que incrementen las ayudas económicas que da la cruz roja,ya que estamos la
espera de esa ayuda pero dicen que no tienen más presupuesto.
"
"225","Que hayan más líneas telefónicas para pedir citas médicas rápido, eso permitiría
que nos atendieran a más personas y sería un buen servicio.
"
"226","Me gustaría que tuviera él servicio de urgencias las 24 horas,ya que es el único
sitio donde nos han presentado el servicio.
"
"227","Que aumenten las ayudas económicas para que todos nos veamos beneficiados ya que
todos estamos a la espera.
"
"228","Especialistas como pediatría, cardiología, oftalmología, ortopedia,ya que es muy
importante para nosotros que tenemos diferentes diagnóstico
"
"229","Más especialistas de odontología, oftalmología, ginecología, pediatras. Para una
atención más completa.
"
"230","Atención dé urgencias para los niños ya que ellos en cualquier momento se
enferman y no tenemos más donde llevarlos.
"
"231","Mi idea es que aporten más dinero a la cruz roja para que las ayudas llegue a
mas personas.
"
"232","El espacio es muy pequeño para atender a toda la población migrante, deberían
tener grandes instalaciones para aumentar la atención.
"
"233","Un trato más humanizado para el personal de la cruz roja veo que tienen muchas
actividades una sola persona.
"
"234","enfermera tienen que hacer muchas funciones y pienso que deberían de tener más
personal para que ella pueda hacer su trabajo bien.
"
"235","La atención médica es muy demorada,creo que es por falta de personal médico y de
enfermeras colapsa porque hay mucha gente.
"
"236","Tener acceso a ginecología soy gestante y no tengo controles ni ecografías ,me
gustaría que lo implementarán para saber cómo viene el bebé.
"
"237","Más lineas telefonicas o por internet para facilitar las citas de las ayudas,
nunca contestan y estamos perdiendo la oportunidad.
"
"238","Muy pequeño el espacio deberían construir un Cruz roja más amplio nos sentimos
estrechos y nos toca esperar en la calle.
"
"239","Atención completa para los adultos donde nos rebicen bien un médico, que no sea
de afán  que nos dedique más tiempo.
"
"240","Más apoyo a la cruz roja para que nos puedan seguir dando las ayudas económicas
a todos los migrantes.
"
"241","Siento que deberían tener más enfermeras, la que está tiene muchas cosas por
hacer y no puede hacer todo sola.
"
"242","Mi idea es poder contar con el servicio de Odontología y oftalmología y que
capaciten al personal sobre humanización ya hay muchos migrantes
"
"243","Nos gustaría tener él servicio de odontología, oftalmología, ginecología,
pediatría estos servicios son muy importantes para los niños.
"
"244","Los servicios de salud dé la cruz roja deberían Ser continuos,para tener una
mejor calidad él día de hoy ya no hay más talleres.
"
"245","Llevó pidiendo una cita y no logro comunicarme, sería bueno que implementarán
más líneas telefónicas para no quedarnos sin la oportunidad.
"
"246","Me gustaría que ampliarán las instalaciones de la cruz roja estamos muy
estrechos y eso no permite una buena atención.
"
"247","La cruz roja es muy buena,pero me gustaría poder contar con el servicio de
ginecología y toma de citología,para las gestantes migrantes.
"
"248","Tener los servicios de oncología, pediatría, ginecología,ya que es fundamental
para tener los servicios de salud completos en la cruz roja.
"
"249","Es díficil obtener una cita para las ayudas, deberían implentrar más líneas
telefónicas Pará que sea más fácil el servicio.
"
"250","Estoy inconforme porque pedí la ayuda económica y me la negaron nunca me
visitarnos para saber sí la necesitaba solo nunca me llamaron.
"
"251","La infraestructura es muy pequeña y no tiene suficiente capacidad para tantas
personas y en cuanto al sistema,colapsa por tanto migrante.
"
"252","Me gustaría que nos atiendan más rápido,faltan más médicos y cada cita se demora
mucho por falta de profesionales.
"
"253","El servicio es bueno,pero la enfermera está muy ocupada y no puede atender bien
porque tiene muchas funciones.
"
"254","Queremos contar con más especialistas como ortopedia, pediatría, enfermeras ,una
enfermería con eso podemos tener un servicio completo
"
"255","Mi bebé lleva 3 semanas con vómito y diarrea y para acceder a una cita  en CRC
es dificil,deseo atención rápida y eficaz ante una emergencia
"
"256","La infraestructura es muy pequeña y esto limita el número de personas que
podemos recibir los servicios, deseo que se amplie el lugar.
"
"257","La atención prestada es muy buena me gustaría poder contar con una
infraestructura más grande y con eso implementar más servicios .
"
"258","Deberían tener un servicio de urgencias las 24 horas para los niños, muchas
veces están enfermos y no tenemos dónde llevarlos.
"
"259","Considero que la infraestructura no es suficiente para la demanda de personas
que requieren este servicio y sería positivo si lo amplían.
"
"260","Cambiar o poner más teléfonos para que atiendan las llamadas,muchas veces
llamamos todo el día y no se logra una cita.
"
"261","Especialistas para enfermedades crónicas, oftalmología,neuropediatras eso nos
ayudaría a estar mejor de salud.
"
"262","Poner más líneas telefónicas, donde sí contesten y puedan dar más atención a las
personas.
"
"263","Darmos la oportunidad de trabajar a los migrantes, asi podriomos pagar
arriendo,comer, y tener una vida mas digna.
"
"264","Darnos apoyo en empleo, que en las empresas nos reciban sin tanto inconveniente
a los migrantes.
"
"265","Me gustaria mas brigadas de salud en altos de la florida para los migrantes,
estamos en abandono y no tenemos quien nos atienda.
"
"266","Mas ofertas laborales para los migrantes, estamos sin empleo y nos es dificil
llevar de comer a mi familia.
"
"267","Dar la oportunidad  de trabajar a los migrantes, asi puedo pagar arriendo,
comer, y tener salud.
"
"268","Hacer campañas de empleo para los migrantes,ya que en ningun lado nos dan
trabajo por nuestra nacionalidad.
"
"269","Mas oportunidad laboral para los migrantes,estoy sin empleo y me es dificil
ayudar a mi familia economicamente.
"
"270","Dar la oportunidad de trabajar a los migrantes estamos sin empleo y asi es
dificil llevar el alimento a la familia.
"
"271","Darnos la oportunidad de trabajar a los venezolanos, ya que en este pais somos
rechazados.
"
"272","No hay citas, llevo un mes sin atencion, se necesita atencion rapida y eficiente
"
"273","No me entregan mis examenes de laboratorio a tiempo y hay demoras
"
"274","No dieron medicamento porque asisti el dia anterior a la brigada de salud y el
medicamento es acetaminofen y mi hijo tiene mucha fiebre
"
"275","Demora en el servicio, no me diron medicamentos porque no aparezco en el sistema
"
"276","No me entregaron mi medicamento  claritromicina, porque no lo cubre el plan de
salud y mi salud depende de el
"
"277","Falta de informacion y medicamentos.
"
