"","x"
"1056","permitir que el usuario pueda elegir el método de pago de su preferencia, en mi
caso los cajeros no me quedan muy cercanos. #cerezos #3
"
"1057","sería bueno que drc donara implementos como una silla de ruedas, ya que mi madre
sufre de artrosis y no tengo como comprarla. #bachué #4
"
"1058","asesoria jurídica para encontrar un cupo en una escuela para mi hijo, no tengo
el documento y por eso me niegan el cupo. #lucero medio #3
"
"1059","mi recomendación es visitar a los beneficiarios antes de entregar la ayuda, de
esa forma evitan fraudes y verifican la información. #suba #3
"
"1060","llevar seguimiento a las personas más vulnerables y si lo requiere complementar
con alimentos, para que no se sientan desamparados. #suba #4
"
"1061","ampliar con más dinero el bono según sus integrantes para comprar alimentos de
mejor  calidad nutricional. #juan rey #2
"
"1062","complementar subsidio económico con kit de aseo personal y bioseguridad ya que
muchas veces nos cuesta comprar esas cosas. #llano grande #3
"
"1063","brindar información clara a los beneficiarios y que mediante un link podamos
referir a conocidos que estén en vulnerabilidad. #suba #4
"
"1064","charlas en métodos de ahorro para toda la familia, debemos trazarnos una meta de
ahorro para que nos alcance el dinero. #toberin #3
"
"1065","me parece que cuando nos van a llamar de otra ong, drc debe notificar por un sms
que seremos llamados para no tener incertidumbre. #aures #2
"
"1066","el espacio para las reuniones es muy reducido recomiendo localizar salones más
grandes para evitar aglomeraciones  #villa elisa #2
"
"1067","convenios con centro especializados en la atención de niños con síndrome de
down, asistencia en salud, soy madre soltera. #patio bonito #5
"
"1068","realizar el pago por efecty ya que en los 2  pagos que recibí  me descontaron al
sacar el dinero del cajero. #barranca #3
"
"1069","estoy agradecida, pero deben censar en barrios vulnerables priorizando a madres
solteras, por el covid se les complica trabajar #bilbao #2
"
"1070","la ayuda me parece buena, pero deberían priorizar a mujeres gestantes y
discapacitados, pues ellos son lo que más lo necesitan #barrancas #4
"
"1071","recomiendo ser más puntuales con las fechas estipuladas o notificar atrasos, ya
que me debió llegar el 29 y aún no me llega #alborizadora #2
"
"1072","priorizar a  discapacitados y adultos mayores, para que cuenten con el beneficio
y no tarden tanto en darlo, ellos lo necesitan. #lisboa #4
"
"1073","quisiera que envíen sms cada vez que realicen el depósito, me da seguridad para
ir a retirar, el cajero me queda algo lejos. #la favorita #2
"
"1074","verificar casa a casa que los beneficiarios en realidad tengan las necesidades
ya expuestas en la encuesta y así evitan fraudes. #prado #4
"
"1075","sugiero que por sms nos informen anticipadamente la fecha exacta del giro para
no ir varias veces al banco. #suba rincon #2
"
"1076","colocar un línea a donde llamemos por si dado caso tenemos inconveniente con la
tarjeta, como dudas de manejo y atrasos de pago. #suba #4
"
"1077","mi idea es que nrc nos de información jurídica por correo, para legalizarme,
poder obtener un trabajo estable y solventarme. #el codito #3
"
"1078","hacer alianzas con ong médicas para que cuando nos incorporamos drc indique cómo
acceder a los servicios de salud gratuitos. #unir #3
"
"1079","que se realicen visitas a los hogares, así saben si realmente la persona
beneficiada requiere de la ayuda, para evitar fraudes. #quirigua #4
"
"1080","quisiera que drc apoye a los emprendedores brindando capacitaciones, en mi caso
de repostería y así podré generar mis ingresos. #casandra #4
"
"1081","acuerdos con supermercados para comprar con la tarjeta y hagan descuento
especial así alcanzaría para comprar medicamentos #villa nueva #3
"
"1082","sedes más centrales en la atención al usuario, el día que fui a reclamar la
tarjeta tome dos buses me queda muy lejos. #alfonso lopez #2
"
"1083","alianzas con centros de salud para realizar campañas en vacunación para los
niños y mujeres en embarazo. #la paz #3
"
"1084","habilitar en la página oficial un link para ingresar nuevos hogares ya que por
donde vivo hay mas necesitados. #bosque calderon #3
"
"1085","programas en atención a las personas de la tercera edad, entregando calcios y
demás nutrientes que hemos perdido por el tiempo #jerusalen #6
"
"1086","durante el tiempo del beneficio nos podrían capacitar en diferentes áreas, me
gustaría aprender costura para trabajar desde casa #unir ii #3
"
"1087","me quedó muy claro cuál es la fecha exacta en la que depositan el cash, me
gustaría que envíen esa información a través de un sms #bachue #3
"
"1088","quisiera que ach brinde posibilidad de realizarnos el hisopado covid-19 a través
de jornadas en barrios más vulnerables #san bernardino #5
"
"1089","me gustaría que la ayuda puedan extenderla, ya que por la pandemia estoy
desempleado y no tengo como solventar a mi familia. #divino niño #3
"
"1090","sería de mucha ayuda que drc compartiera nuestros datos a otras ong, para poder
contar con otra ayuda cuando esta culmine. #quirigua #5
"
"1091","por favor regalarnos la confirmación del depósito a través de un sms o una
llamada, porque no hay una hora exacta para el pago. #la perla #5
"
"1092","en la encuesta nos permitan referir o recomendar a 1 persona más vulnerable que
nosotros pero que también necesite el beneficio #gaviotas #2
"
"1093","enviar videos vía whatsapp sobre los métodos para ahorrar y distribuir bien el
cash porque me parecen que son de mucha ayuda. #zipaquirá #6
"
"1094","ayuda de ong para que regalen elementos de aseo para mi padre que lo tengo
hospitalizado con covid-19, no alcanzo comprarlos. #lijaca #3
"
"1095","que avisen por sms que ya el dinero esta depositado para ir confiados al banco.
#mochuelo #2
"
"1096","colocar una línea de whatsapp para consultas, quisiera saber cómo podría
inscribirse mi hermana también, pues necesita de la ayuda. #suba #3
"
"1097","estudiar los casos por si la persona tienen una discapacidad o son madre
soltera, entregar la tarjeta directamente a casa. #cerro norte #2
"
"1098","es buena ayuda la pueden complementar con una entrega mensual de kits de
alimento, así podría invertir el cash y pagar arriendo #martires #4
"
"1099","sería bueno que nos sigan dando charlas por llamadas, en esta ocasión me
gustaría sobre la xenofobia, muchos vivimos esto a diario. #suba #3
"
"1100","procurar mantener orden con fechas de consignación, me dijeron que el 24 pero
está disponible el 28, avisar mediante sms #jerusalén #3
"
"1101","en el sms de aviso incluir el tiempo restante para recibir el beneficio, así
despejamos dudas e inquietudes #santa viviana #2
"
"1102","recomiendo que hagan una llamada mensual de seguimiento para corroborar que
hayamos retirado el cash sin ningún inconveniente. #rincón #3
"
"1103","me gustaría que así como me avisan de jornadas de atención a madres gestantes,
puedan hacerlo con madres de pocos recursos #gloria lara #2
"
"1104","gestionar a través de fundaciones herramientas de estudio como tablet, ya que mi
hijo no tiene como ver sus clases virtuales. #bogota #2
"
"1105","a través de vídeos enviados por whatsapp, nos pueden reforzar la charla
brindada, para invertir  y ahorrar mejor el cash. #verbenal #3
"
"1106","tardé casi 3 meses en recibir el beneficio, recomiendo determinar a usuarios por
barrios para no colapsar lista de espera #verbenal #2
"
"1107","recomiendo realizar estudios más invasivos para determinar que la persona en
verdad necesite la ayuda económica. #minuto de dios #4
"
"1108","al realizar la encuesta programar 1 visita domiciliaria y tener en cuenta las
condiciones en que viven para asignar el monto. #costa rica #2
"
"1109","sugiero poder ampliar la ayuda monetaria por 5 meses mas, ya que la situación
por esos paros no puedo vender mis bolsas. #suba rincon #3
"
"1110","me gustaría que fueran constantes con el envío de sms de confirmación del
depósito porque solo lo recibí en el primer mes. #salitre #2
"
"1111","me gustaría que orienten a los beneficiarios, a como debemos invertir cash, para
invertirlo en mi negocio de empanadas. #eduardo santos #3
"
"1112","para generar mayor tranquilidad aería bueno hacer uso de sms para dar certeza a
los usuarios de disponibilidad del cash #suba gaitana #3
"
"1113","que nrc vaya a los barrios más vulnerables y brinde kit alimenticio a las
personas que se censaron pero no tienen la ayuda. #el mirador #5
"
"1114","dar facilidad de acceso a las personas necesitadas, puede ser a través de un
link para que podamos reenviarlo al que lo requiera. #rincón #5
"
"1115","notificar por sms cuando haya atrasos en los pagos y brindar una nueva fecha
para retirar, ya que así no nos dejan con la duda. #bachué #3
"
"1116","hacer alianza con efecty para que también pueda ser método de pago, porque me
toca tomar transporte para ir al cajero. #luis carlos galán #4
"
"1117","mi idea es que tengan en cuenta cuando haya paro y realizar los pagos antes, ya
que destruyeron los cajeros, no sé donde retirar. #lisboa #2
"
"1118","informar a través de redes sociales y de difusiones en whatsapp cada cuánto
abren inscripciones al programa, así corremos la voz. #bilbao #3
"
"1119","realizar censos en localidades que tienen alta concentración de migrantes, en
suba por ejemplo, necesitan el beneficio #suba #2
"
"1120","me gustaría que enviaran sms con la confirmación del depósito cada mes para
movilizarme cuando el pago esté disponible, vivo lejos. #chía #2
"
"1121","enviar mensajes por whatsapp alusivos al ahorro para que las familias lo
conviertan en hábitos y tengas metas de ahorro. #isla del sol #3
"
"1122","que nrc tenga convenio con instituciones privadas, ya que de esa manera apoyan
la educación de los niños sin documentación #san cristóbal #2
"
"1123","al momento de entregar el cash, tener en cuenta personas de la tercera edad, ya
que no pueden conseguir sustento propio #las orquídeas #6
"
"1124","realizar capacitaciones de carpintería en donde entreguen herramientas, para
tener un trabajo estable y solventar a mi familia. #alaska #4
"
"1125","alianza con otras ong, considerar programas certificados para fomentar la
formación profesional de migrantes, para apoyarlos #suba bilbao #4
"
"1126","recomiendo que nos puedan compartir información vía whatsapp sobre nuevos
programas así podemos participar para una proxima ayuda. #suba #3
"
"1127","podrían realizar visitas casa a casa para que valoren las necesidades de cada
hogar y remitan a otras organizaciones. #villa nueva #3
"
"1128","crear un link oficial para averiguar cuando hay nuevas focalizaciones para que
otras familias puedan recibir la ayuda. #toberin #2
"
"1129","sería de mucha ayuda que nrc tengo alianza con el sena, para que los jóvenes
logren capacitarse y no anden en tiempo de ocio. #suba #4
"
"1130","ach suministre canales o rutas de atención a migrantes para orientarnos en
cualquier situación que se presenta #fontibon #2
"
"1131","deseo envíen sms confirmando la consignación del cash, no sé exactamente el día
que llega y no puedo salir pues tengo 2 hijos. #triunfo #3
"
"1132","me gustaría que nrc nos regalara a las embarazadas un kit con elementos
necesarios para el primer día del niño. #gran colombia #2
"
"1133","me parece que nrc nos puede orientar cuando realizan la charla, de cómo podemos
legalizarnos para conseguir un trabajo estable. #usaquén #2
"
"1134","me gustaría que por medio de un sms notifiquen el depósito, para que así
tengamos más seguridad al momento de retirar el cash. #centro #2
"
"1135","sugiero que antes de entregar el beneficio visiten a los usuarios, para corrobar
si los datos suministrados si son reales. #barrancas #2
"
"1136","completamentar el beneficio con kit alimenticio, ya que soy madre de 3 niños y
no tengo un trabajo, sería de mucha ayuda para mi. #el sol #3
"
"1137","sugiero que a los casos de bloqueo de tarjeta sean atendido rápidamente, tuve un
inconveniente y no he recibido respuesta. #suba rincon #2
"
"1138","propongo que nrc les comparta nuestros documentos a otra ong para estas nos
sigan brindado ayuda, por mi edad no me dan trabajo. #lisboa #5
"
"1139","me gustaría que ach brinde atención médica a niños, no contamos con seguro
médico para que mi hijo sea atendido #jerusalén #2
"
"1140","hay falsa información en redes sociales, hacer publicidad en facebook para
evitar la desinformación y para prevenir fraudes #santa isabel #3
"
"1141","sugiero que a través de un sms nos notifiquen la disponibilidad del cash, pues
nos daría más seguridad al ir a retirar. #juan josé rondon #3
"
"1142","impulsar ideas de emprendimiento dando implementos, sé repostería, para iniciar
me falta batidora y moldes, así genero estabilidad. #suba #2
"
"1143","sugiero dividir el monto y entregarlo en dos partidas ya que no me rinde y no
puedo distribuirlo porque todo se va en arriendo. #robles #3
"
"1144","me siento insegura retirando el cash por cajero además de no saber usarlo, en
estos casos entregarlo a través de efecty #los libertadores #2
"
"1145","definir y asignar una sola fecha para realizar el giro porque nos informaron una
pero el sms llega en otra, me tienen confundida. #altico #2
"
"1146","es útil que cuando nos entreguen la tarjeta podamos disponer de inmediato del
cash, paso un mes para recibir el primer beneficio. #lisboa #2
"
"1147","recomiendo enviar el sms con días de anticipación ya que llega 3 días después y
me genera dudas #el codito #3
"
"1148","tomar en cuenta más cantidad de colombianos de la que ya tienen estipulada para
que también reciben el beneficio #ciudad bolívar #3
"
"1149","informar al beneficiario que organización nos va contactar ya sea en reunión o
sms porque dijeron no respondiéramos a preguntas #hogares #2
"
"1150","hacer censos en poblaciones vulnerables para dar esta ayuda, muchas personas no
tienen conocimiento de estos beneficios. #santo domingo #2
"
"1151","contar a usuarios a través de whatsapp otros beneficios que ofrece ach, para
tener conocimiento y aprovecharlos también #la favorita #2
"
"1152","avisar el motivo de convocatoria a charlas, en mi caso sentí mucha incertidumbre
por no saber con que fin me invitaron #olarte #2
"
"1153","sería bueno que al censarnos dieran un folleto donde aparezcan las líneas de
atención, así comunicarnos por cualquier inquietud. #bachue #4
"
"1154","cuando se realice el retiro del cash notificar a través de un sms para estar
atentos a los movimientos de la cuenta #vereda panama #3
"
"1155","enviar videos informativos de los cajeros autorizados para realizar el retiro
del cash y tener siempre esta información #mirador corinto #4
"
"1156","debo tomar transporte para dirigirme al cajero y realizar el retiro del cash
sugiero utilizar pagatodos que están cerca #san mateo #3
"
"1157","realizar video conferencias una vez al mes para recibir asesorías sobre los
temas tratados en las reuniones y despejar dudas #el progreso #3
"
"1158","habilitar puntos de atención en los barrios vulnerables para dar asesoría sobre
como acceder a las ayudas que ofrece drc. #caracoli #5
"
"1159","crear una aplicación que permita visualizar la consignación del cash y que no
genere cobros porque no hay fecha fija #el arrollo #3
"
"1160","realizar constante retroalimentación en temas como puntos de retiro, duración a
través de videos conferencia o sms #los robles #2
"
"1161","cuando se presente retraso en la fecha de la consignación del cash avisar con
anticipación y no generar incertidumbre #tocancipa #3
"
"1162","podrían enviarnos el folleto de manera digital al whatsapp, ya que éste puede
deteriorarse y perdemos la información valiosa. #lisboa #4
"
"1163","dar asesoría comunitaria telefónica en la que resuelvan dudas sobre cómo
legalizar nuestra condición, cada caso es distinto #santa helena #5
"
"1164","habilitar un chat de whatsapp para novedades urgentes con el beneficio, ya que
la comunicación por llamada es imposible #barrancas #4
"
"1165","por favor enviar sms con la confirmación del depósito el mismo día que hagan la
consignación, así cumplirían con la fecha. #corintios 3 #2
"
"1166","sería bueno que cuenten con una línea exclusiva para brindar orientación, me
gustaría saber como sacar el permiso para trabajar. #miguel #4
"
"1167","retroalimentar con el beneficiario los temas tratados en las reuniones como
fechas, puntos de retiro y monto a recibir #limonal #3
"
"1168","contar con un chat interactivo donde un asesor nos oriente en caso de cabios de
clave, daños o bloqueos de la tarjeta #tocancipa #2
"
"1169","si van a cambiar la fecha de los giros por favor notificar a través de un sms
porque fui en la fecha acordada y no había saldo. #cerezos #2
"
"1170","que envíen al whatsapp la grabación de las charlas que dieron antes entregar la
tarjeta, para así tener la información clara #santa lucía #3
"
"1171","me gustaría recibir un aviso de confirmación para disponer del cash, un sms
sería buena opción para ir certeramente al cajero #el codito #2
"
"1172","sería más cómodo para mí recibir un sms que me indique disponibilidad del
beneficio y dirigirme con certeza al cajero #colinas #6
"
"1173","establecer una fecha exacta para el depósito del cash, porque he ido al cajero y
este no se encuentra consignado #elmirador #4
"
"1174","consignar cash cada 15 días con el fin de tener acceso a productos y alimentos
básicos porque no me esta alcanzando para el mes #mirador #6
"
"1175","socializar y acordar con el beneficiario el operador de retiro para que se
escoja por mayor facilidad de acceso un pagatodo # el progreso #3
"
"1176","notificar a través de sms de texto la consignación del cash porque este me llega
varios días después de realizar el retiro #la isla #4
"
"1177","propongo realizar censos casa a casa para favorecer a la población migrante,
este es 1 beneficio que me ha ayudado mucho #rincón del lago #3
"
"1178","profundizar más las caracterizaciones, debe ser visitando los hogares y
conociendo sus gastos, para que con esto asigne el monto #venecia #3
"
"1179","coordinar la fecha de envío porque no está llegando en la fecha acordada, a
través de sms informar cuál será la nueva fecha. #casuca #2
"
"1180","contar con centro de atención fijo donde puedan dar información y puedan
resolver inquietudes de usuarios, sería  muy bueno #suba #2
"
"1181","quisiera que los puntos de reunión sean más cercanos a la zona donde vivo,
quedaba muy lejos donde fui la primera vez y me perdí #usaquen #5
"
"1182","visitar a los usuarios y analizar la posibilidad de darles un apoyo alimenticio,
me quedé sin empleo desde hace tres meses #santa viviana #2
"
"1183","recomiendo agregar al programa bonos canjeables para alimento porque el cash
solo cubre servicios y alquiler y no para alimentos #mirador #2
"
"1184","ubicar puntos de atención en los barrios vulnerables, muchas personas quieren
acceder al beneficio y no saben como hacerlo #sierra morena #3
"
"1185","corroborar la información dada por los usuarios a través de una visita a los
hogares para que eviten beneficiar al que no necesita. #suba #2
"
"1186","facilitar número de contacto que podamos compartir entre personas de nuestra
comunidad, que notablemente necesitan el cash #el codito #4
"
"1187","el dinero lo consignan antes de las fechas dichas en la reunión, sería bueno
avisar con un sms para estar prevenidos #santa cecilia #2
"
"1188","con un sms informar que vamos a recibir llamadas de kuja kuja, pues así se
generaría tranquilidad para responder a las preguntas. #bachue #3
"
"1189","consulta de disponibilidad del beneficio por página web sería una buena opción
ya que los mensajes pueden llegar a destiempo #el codito #3
"
"1190","al realizar el censo analizar la posibilidad de recibir copias de documentos, no
tengo como ir a venezuela a buscar el original #caracoli #4
"
"1191","en un futuro realizar un censo en mi comunidad, muchos vecinos no reciben ningún
beneficio y son familias numerosas. #santo domingo #2
"
"1192","me gustaría que al consignar envíen un sms para notificar el depósito, para no
tener que estar yendo a consultar el saldo. #corinto iii #2
"
"1193","para recordar los contactos de drc sería bueno que enviaran folletos digitales
al beneficiarios porque no recuerdo como hacerlo #ducales #5
"
"1194","los migrantes que fueron censados y no salieron favorecidos darles una ayuda
alimenticia, no contamos con sueldo fijo. #santo domingo #6
"
"1195","sugiero realizar visitas al participante y validar si realmente necesita la
ayuda y no le quite oportunidad a otros #el mirador #3
"
"1196","habilitar línea de whatsapp para que podamos realizar actualización de datos e
incluir familiares en el núcleo familiar. #ciudad bolívar #4
"
"1197","tomar en cuenta personas con discapacidad que se postularon para recibir el
cash, pero no recibieron respuesta alguna #santa cecilia #2
"
"1198","entregar como complemento un subsidio médico, ya que en un año que llevo en
colombia no he podido acceder al sistema de salud. #engativá #2
"
"1199","sugiero crear plataforma virtual que permita consultar el saldo porque vivo
lejos del cajero y así no haría el viaje en vano. #altico #2
"
"1200","inscribir principalmente a las familias que tienen hijo, para que este apoyo
llegué a fortalecer los ingresos del que si necesita #lisboa #3
"
"1201","realizar alianzas con entidades de giros para que sea posible retirar en efecty,
porque vivo bastante retirada del cajero. #cerezos #4
"
"1202","para evitar aglomeraciones, procurar convocar 30 minutos después de llegar todo
el personal de ach al sitio de reunión #divino niño #2
"
"1203","tener convenios con más bancos, sería bueno el único cajero del sector no
funciona me tengo que movilizar a otro barrio #la victoria #3
"
"1204","importante tener certeza de disponibilidad del beneficio para no aglomerarse en
cajeros, sms de aviso es una buena opción #santa cecilia #2
"
"1205","enviar un sms notificando la disponibilidad del cash para dirigirme al cajero
una sola vez y no perder la ida #vereda panama #4
"
"1206","ampliar la cobertura de esta manera favorecer más familias vulnerables de mi
sector, hay muchas personas desempleadas. #santa viviana #5
"
"1207","me gustaría que focalizaran a madres cabeza de hogar y ayudarlas con un bono
alimenticio para redimirlo en supermercados. #santa viviana #2
"
"1208","censar nuevamente en nuestra comunidad para ofrecer la ayuda económica, muchos
vecinos quedaron por fuera y la necesitan. #sierra morena #2
"
"1209","divulgar por los medios de comunicación local donde están ubicados los puntos de
atención de drc mis vecinos lo desconocen. #villa sandra #5
"
"1210","crear un programa que brinde ayuda económica a emprendimientos de migrantes así
podrían tener una estabilidad económica. #bonanza sur #3
"
"1211","disponer puntos de orientación al beneficiario para tramitar con rapidez la
tarjeta por perdida ya que se tardan en asignarla #la isla #2
"
"1212","enviar folletos digitales con información de números de atención en caso de que
se presenten daños o bloqueos de la tarjeta #la isla #4
"
"1213","apoyar emprendimientos propios con implementos, deseo vender comidas rápidas
pues me encuentro desempleada #lucero #2
"
"1214","que puedan enviar a todos los usuarios el sms de la confirmación del depósito
pues yo no lo recibo, así iría segura al cajero. #altico #5
"
"1215","utilizar operadores como efecty o pagatodo que son de fácil acceso y no generan
cobros por manejo o transacción #quintanares #4
"
"1216","en mi comunidad hay un albergue sería bueno que drc se acerque hasta acá para
censar y brindarle la ayuda a estas personas #santa viviana #2
"
"1217","enviar sms informativos del buen uso y el paso a paso del cajero electrónico
para prevenir daños o bloqueo de la tarjeta #balcanes #5
"
"1218","permitir que recomendemos a personas en situación de vulnerabilidad, conozco
familias con niños que requieren de estos apoyos. #fatima #4
"
"1219","es mejor si el pago se hace quincenal, de ese modo se podría abastecer la
canasta familiar dos veces al mes para que rinda. #villa maria #3
"
"1220","para no generar inquietud, sería interesante que nos cuenten cómo consiguieron
nuestro contacto para ser parte de ach #el carmen #3
"
"1221","contar con un chat interactivo en tiempo real para consultar sobre temas como
punto de retiro, tiempos y montos de la ayuda #el arrollo #3
"
"1222","ofrecer brigadas de salud en poblaciones vulnerables, necesito un certificado
médico de mi hija para matricularla en el cdi #los cerezos #2
"
"1223","enseñar a los usuarios como se usa el cajero, no sabía cómo utilizarlo y una
trabajadora del banco me tuvo que explicar. #tres reyes #3
"
"1224","hacer brigadas en nuestro barrio para focalizar a los migrantes que no reciben
beneficios y darles una ayuda alimenticia. #sierra morena #4
"
"1225","enviar sms de notificación cuando se encuentre disponible el cash y dirigirme
una sola vez al cajero porque este queda retirado #florida #4
"
"1226","sugiero que vuelvan a censar en nuestra comunidad muchas personas en estado de
vulnerabilidad quedaron por fuera de la ayuda. #caracoli #2
"
"1227","realizar alguna alianza con efecty para que también pueda ser una alternativa de
pago, pues vivo bastante retirada del cajero #las cruces #2
"
"1228","unir a grupos de whatsapp a beneficiarios para avisarles de manera masiva cuando
el cash se encuentra disponible #república de canadá #2
"
"1229","en caracterización tomar en cuenta la situación que viven los usuarios y si es
necesario extender el tiempo de beneficio #lucero bajo #6
"
