"","x"
"706","me gustaría incluyeran a más cantidad de colombianos en el programa, hay muchos
que por la pademia pasan hambre #patio bonito #3
"
"707","la inscripción se hagan directamente de la página de drc, así evitar que
inescrupulosos se aprovechen de la necesidad. #santo domingo #3
"
"708","me gustaría que hagan entrega de cartillas educativas para que en casa junto a
nuestros niños aprendamos cosas nuevas. #3 esquinas #3
"
"709","nos den la opción vía telefónica para hacer actualización de residencia en los
datos, nos facilitarían el proceso de cambio #villa sandra #4
"
"710","sería bueno que nos suministren una lista de lugares donde se consigan los
alimentos a mas bajo costo, así nos rendiría el cash. #toberin #4
"
"711","en el punto donde nos entregan la tarjeta y nos dan la charla sería bueno que
nos donaran tapabocas o implementos de bioseguridad #codito #3
"
"712","complementar las ayudas entregando kits para bebés, por su alto costo me es
difícil adquirir la leche fórmula y pañales. #santa viviana #2
"
"713","sería bueno ampliar por 4 meses más  la ayuda económica ya que por estos paros
no se ha podido trabajar tranquilamente #la esmeralda # 3
"
"714","fuentes de empleo dentro de nrc, realice capacitaciones en atención al cliente y
me gustaría trabajar con la organización #villa maría #3
"
"715","habilitar un página para hacer actualización de datos, me mudé de casa y
quisiera que tengan mi nueva dirección. #quirigua #3
"
"716","facilitar información importante dada en charlas a través en correo electrónico,
así podamos tenerla a la mano #caracoli #3
"
"717","drc nos pueda apoyar con capacitaciones de emprendimiento, así tendríamos una
orientación para iniciar un negocio. #santo domingo #4
"
"718","más personas encargadas en la selección de los beneficiarios, en mi caso tuve
que esperar 8 meses al cash y es mucho tiempo #sotavento #2.
"
"719","sería bueno que se pueda ingresar a nuevas personas ya que después de la
encuesta han llegado personas a vivir en casa. #bosa linda #2
"
"720","realizar acompañamiento a los adultos mayores, así nos brindan orientación sobre
el acceso a servicios de salud, entre otros. #elisa #6
"
"721","poder acceder a la cuenta bancaria para revisar cuando consignen, entro al link
que nos dieron pero a sido imposible ingresar. #bilbao #4
"
"722","la situación actual es mucho más crítica por eso considero que deberían
complementar la ayuda entregando un kit de alimentos. #bilbao #3
"
"723","podrían incluir asistencia médica dentro del proyecto de nrc, mis hijos
requieren de dicha atención y no se donde acudir #la bombonera #3.
"
"724","me gustaría que complementaran la ayuda con bolsas de alimentos, ya que sólo
puedo pagar arriendo #rincón del diamante #4
"
"725","tener personal adicional para la selección de los beneficiarios, así el tramite
para asignar la ayuda sería menos tardío #san antonio #2.
"
"726","enviar confirmación del depósito a través de correo electrónico porque siempre
me toca llamar y preguntar si ya depositaron. #villa cindy #2
"
"727","crear grupo de whatsapp para dar información sobre el manejo de violencia contra
la mujer ya que no sabemos a donde llamar. #san juanito #2
"
"728","me gustaría mucho que este apoyo viniera acompañado con kit de alimentos, pues
el cash no es suficiente, estoy desempleada #san lorenzo #2
"
"729","para que este programa pueda beneficiar a más personas considero permitir a cada
usuario sugerir una familia vulnerable #villa de granada #3
"
"730","con un mensaje notificarnos que se cambia la fecha del depósito así nos evitan
la incertidumbre que genera la espera. #santa viviana #3
"
"731","no tengo muy claro aún durante cuánto tiempo voy a recibir la ayuda quisiera que
en un sms nos dijeran lo que falta. #santa cecilia #4
"
"732","realizar charlas sobre nutrición a menudo y seguido de esto regalar kit de
vitaminas para los niños en bajo peso. #nueva zelandia #3
"
"733","sugiero que hagan censos 3 veces en el mes, para darle oportunidad a más
familias de recibir el apoyo económico queda drc. #el altico #2
"
"734","sería bueno que la caracterización sea mas amplia para que identifiquen todas la
necesidades y luego brinden orientación. #quirigua #2
"
"735","sería mas completo si hicieran acompañamiento a los beneficiarios, pues no se
trata solo de dinero, también sentirnos apoyados. #quirigua #3
"
"736","enviar el sms donde informan que ya se hizo el depósito, normalmente no llega y
debemos ir a la suerte a consultar. #santa viviana #3
"
"737","de ocasionarse algún retraso para el pago, por favor informar por medio de sms
para dar tranquilidad y confianza al usuario #oasis #3
"
"738","notificar que ya disponemos del cash a través de una llamada, de esa manera
podrían resolver alguna duda que presentemos. #isla del sol #3
"
"739","cuando el cash no llegue en la fecha estipulada podrían notificarnos qué día ha
sido asignado el depósito, evitan zozobra. #las granjas #4
"
"740","aún tengo duda si es durante 6 meses o 3 meses, por lo que es mejor que nos
envíen un whatsapp con esta información para saber. #berbenal #3
"
"741","es necesario que drc disponga de líneas telefónicas para que migrantes puedan
acceder a estos beneficios rápida y fácilmente. #el carmen #4
"
"742","procurar cumplir con la fecha del cash pues actualmente con eso dispongo para el
arriendo, el señor donde vivo no es muy tolerante. #suba #3
"
"743","poca comunicación ya que no me entero cuando depositan y para nosotros es muy
importante que esto pase, así podemos salir. #berbenal #3
"
"744","charlas en prácticas de ahorro para toda la familia y regalar alcancías para
crear estos buenos hábitos #suba lisboa #4
"
"745","corroborar la información por medio de visitas de esa manera pueden evitar
beneficiarios fraudulentos, hay gente que no necesita. #paris #3
"
"746","mayor organización previa al pago para que puedan cumplir con las fechas
establecidas o en su defecto darnos la nueva fecha. #la estrada #3
"
"747","hacer 3 visitas para corroborar la información, verificar el avance de la ayuda
y conocer las condiciones en que finalizamos. #quirigua #4
"
"748","notificar vía sms cuando el deposito este disponible, de esa manera me evitaría
el traslado innecesario al cajero #suba salistre #3.
"
"749","líneas telefónicas efectivas para la comunicación, es bastante complejo lograr
tener un contacto con ellos. #soacha #2
"
"750","tener puntos móviles con apoyo psicológico en las distintas zonas, muchas
personas necesitan de esta atención por depresión. #florida #4
"
"751","completar este apoyo más adelante con entrega de alimentos, puesto que la
situación que vivimos nos complica abastecernos. #los cerezos #3
"
"752","crear un programa alterno en dónde nos capaciten en peluquería, así podemos
implementar el cash en la creación de negocio #villa gloria #3
"
"753","crear un sistema donde no se repitan las ayudas para ingresar nuevos hogares
necesitados, hay muchas familias vulnerables. #verbenal #5
"
"754","que puedan agilizar el proceso de entrega de la tarjeta ya que se dé muchas
personas que lo están esperando y lo necesitan. #el carmen #4
"
"755","tener alianzas con centros médicos para realizar exámenes ya que me encuentro
embarazada y no logro hacermelos todos a tiempo. #guikany #2
"
"756","el sector donde vivo es muy necesitado, hacer caracterizaciones para que según
el nivel de vulnerabilidad se ayude prontamente. #mirador #5
"
"757","por medio de sms dar consejos para mejorar nuestros hábitos alimenticios y así
mismo tener una vida saludable, tengo 2 hijos #la española #2
"
"758","no recibo notificación alguna cuando está disponible el dinero, me gustaría
recibir un sms para dirigirme al cajero #san francisco #3
"
"759","como complemento entregar bonos de alimentos a las familias mas vulnerables, ya
que en su mayoría solo alcanza para arriendo. #maria #2
"
"760","es más cómodo tener certeza de disponibilidad del beneficio a través de un sms o
llamada que confirme fecha de pago #nueva colombia #5
"
"761","crear grupos de whatsapp con los beneficiarios de los otros socios para generar
espacios de diálogo y compartir información #isla del sol #2
"
"762","muchos de los beneficiarios estamos de forma legal, me gustaría que drc hiciera
una jornada de empleo para estas personas. #florida #3
"
"763","en la inscripción del núcleo familiar, puedan recibir una copia del documento de
cada persona a veces no tenemos el original. #balcanes #4
"
"764","realizar una gran alianza con otras organizaciones para que el programa abarque
todos los ámbitos familiares. #santa lucia #4
"
"765","como madre primeriza me gustaría que dieran algunas charlas acerca de crianza y
cuidados del bebé, sería maravilloso #minuto de dios #2
"
"766","por  medio de sms notificarme el día de la consignación para ir seguros al
cajero solo me llego la primera vez. #suba rincon #4
"
"767","charlas psicológicas para mejorar mi estado emocional y el de todo mi hogar, así
podremos avanzar como un equipo.  #el codito #3
"
"768","cuando entregan la tarjeta del banco deberían regalar bolsas de mercado ya que
el pago no es inmediato. #lisboa #5
"
"769","la entrega de la tarjeta debería ser a través de una visita así corroboran la
información y brindan más seguridad en el proceso #santa fe #2
"
"770","incluir asesoría relacionada al acceso laboral, considero es la mejor manera de
ayudar al extranjero a tener un estabilidad #suba bilbao #4.
"
"771","mi propuesta es que para darle paso a otras personas drc, pueda reducir los
meses pero con la misma cantidad de dinero #luis carlos galan #4
"
"772","un mayor acercamiento por parte de nrc a las comunidades, muchos desconocen su
existencia y estan necesitando de ayuda #suba bilbao #3.
"
"773","para evitar descuento del dinero por hacer varias consultas en el cajero, sería
bueno que nos avisarán del pago por un sms. #loma linda #4
"
"774","creo que sería bueno que nos orientarán a través de charlas sobre todo el
proceso nuevo de legalización, estoy interesada. #cerezos #4
"
"775","alianzas con organizaciones para ayudar con medicamentos para embarazadas, ácido
fólico, hierro y suplementos vitamínicos. #el codito # 2
"
"776","un convenio con el banco para que ellos no cobren comisión cada vez que se
retira, ya que se descuenta de la tarjeta siempre. #claret #2
"
"777","dentro del proyecto realizar talleres para enseñar la pastelería, soy repostera
y me gustaría colaborar para dar clases #tranquilandia #3.
"
"778","usar otra plataforma de retiro, preferiría daviplata,  ya que el cajero me
descuenta y es más peligroso retirar allí #el tesoro #3
"
"779","asesorar a los jóvenes que desean emprender, de esta manera seríamos
independientes y generadores de empleo e ingresos. #caracoli #2
"
"780","enviar el sms donde informan que ya se gizo el depósito, normalmente no llega y
dedemos ir a la suerte a consultar. #santa viviana #3
"
"781","colocar un punto físico, sería más sencillo para la población exponer sus casos
para recibir este apoyo económico. #corintios #4
"
"782","crear una plataforma que sea solo para el funcionamiento de inscripciones,
teniendo en cuenta que las personas buscan apoyo. #limonar #2
"
"783","reducir el tiempo de servicio a la mitad para que el monto mensual llegue por
una cantidad doble y alcance para todos los gastos #robles #2
"
"784","realizar las consignaciones cada 15 días a los usuarios que deben pagar alquiler
a diario, para que no se les acumule la deuda #florida #3
"
"785","realizar talleres prácticos en proyectos de emprendimiento; en peluquería tengo
experiencia y necesito maquinarias en general. #zipaquira #3
"
"786","verificar los datos entregados por los usuarios por medio de visita sociales, de
esta manera se puede prevenir el fraude. #san isidro #2
"
"787","en alianza con otras ong pueden facilitarnos el acceso al servicio médico, no
recibo atención desde que estoy en colombia. #sierra morena #2
"
"788","recibir ayudas en útiles escolares ya que mis hijos necesitan materiales,
cuadernos, colores, lapices y colbón. #corinto #3
"
"789","sería mejor que depositen en efecty ya que en el banco cobran por cada consulta,
la última vez me descontaron 10.000. #fatima #3
"
"790","crear programas para emprendedores, sería muy satisfactorio para salir adelante
por nuestra cuenta durante la pandemia #suba rincón #4.
"
"791","visitar a usuarios para conocer si realmente necesitan el beneficio, para
brindar la oportunidad a otros más desfavorecidos #caracoli #3
"
"792","debido a la difícil situación que estamos viviendo, quisiera que consideraran
extender un poco más de tiempo el beneficio #divino niño #2
"
"793","alianza con organizaciones donde brinden charlas sobre la crianza y
acompañamiento a los jóvenes en tiempos de pandemia. #suba rincón #3
"
"794","crear un aplicativo en el cual nuevas personas puedan registrarse, hay
comunidades que no tienen idea como ser parte de nrc #villa elisa #2.
"
"795","comunicarse nuevamente con las personas que no han salido seleccionadas, muchos
de ellos realmente necesitan el beneficio #av. 56 sur #3
"
"796","mediante llamadas informar que ya está el dinero disponible, así vamos con la
seguridad de que si se podrá retirar. #roble sur #2
"
"797","tener una línea gratuita para darnos información de cuando abren nuevos cupos ya
que tengo familiares interesados. #el chorillo #5
"
"798","tratar de incluir a todos los usuarios para el envío del sms con la información
del depósito ya que no me han avisado. #codito #2
"
"799","realizar encuesta y visita en poblaciones alejadas de la ciudad, y reciban el
beneficio ya que son poco tomados en cuenta #san bernardino #4
"
"800","dispongan de asistencia jurídica vía telefónica, para que podamos ser orientados
de como sacar el nuevo permiso implementado #el oasis #2.
"
"801","organizar talleres virtuales, para que los beneficiarios durante el proyecto se
capaciten y así se defiendan por sus medios #portal sur #2.
"
"802","no aprobar el beneficio hasta haber visitado el hogar de la persona, para no
facilitar la ayuda quien no la necesite # limonar
"
"803","que al firmar el contrato nos garanticen que recibiremos la confirmación del
depósito sea por sms o llamada pero todos los meses #gaitana #2
"
"804","notificar vía sms que ya está el dinero disponible, para acercarnos a retirar
con la seguridad de no perder el viaje. #carolina #3
"
"805","es muy buen servicio, pueden crear un link en el que las personas que no se han
visto beneficiadas puedan exponer su situación. #lisboa #3
"
"806","entregar videos recreativos para sacar el dinero del cajero ya que muchas veces
nos aturdimos cuando estamos en el banco. #suba rincon #3
"
"807","al recibir la ayuda monetaria sería bueno entregar mitad en dinero y la otra en
alimentos nutricionales. #sopo gratamira #2
"
"808","orientación psicológica para salir de traumas por todo el tema de migración, drc
podría ofrecer visitas en los barrios. #villa esperanza #3
"
"809","convenio con el banco para que mediante sms nos informen el saldo disponible
para retirar, no siempre se retira todo el cash. #perdomo #3
"
"810","que el lapso entre el registro y selección sea más corto, se logra colocando
personal adicional en el área de reclutamiento #suba bilbao #2.
"
"811","sería bueno que se pueda cambiar la contraseña para evitar riesgos, para ello
podrían enviar un video de orientación vía sms. #viviana #3
"
"812","entidad en conjunto con ach donde nos ayuden en información y procesos para
obtener la legalidad colombiana de mi familia #buenos aires #3.
"
"813","capacitar con cursos sobre cómo podemos invertir el bono porque quiero generar
ingresos y compraré un carro de comida. #luis carlos galán #3
"
"814","sugiero permitir inscripciones de colombianos también en el programa porque
conozco muchos que también son vulnerables. #gaitana #3
"
"815","me gustaría que al finalizar el programa me puedan remitir a otra organización
de ayudas, tengo 5 niños que debo alimentar. #la balza #2
"
"816","considero importante que informen por sms la disponibilidad del dinero, ya que
no estan las condiciones para salir a cada momento #tesoro #3
"
"817","sólo creo que deberían estipular una fecha y fijarla para que cada mes sepamos
que desde ese día contamos con la ayuda. #la pepita #2
"
"818","visitar las veredas para las nuevas encuestas, ya que hay familias vulnerables
que necesitan de ayuda humanitaria. #verganzo #2
"
"819","me hubiese gustado que me informaran de esta llamada ya que estamos muy
prevenidos al responder las preguntas. #floridablanca #3
"
"820","a los beneficiarios que presentan síntomas de covid-19, ayudarlos indicando a
donde acudir para realizarse la prueba gratuita #robles #2
"
"821","apoyar a los usuarios que necesitan ser operados con una parte de su costo,
podremos pagar el resto con el dinero del beneficio #esperanza#4
"
"822","brindar durante el tiempo de ayuda leche y pañales a madres solteras gestantes,
no me queda dinero, lo usa para pagar arriendo #cantalejo #3
"
"823","visitar los hogares de los usuarios y brindar alimentos mensuales a los que
noten más desfavorecidos, muchos estamos sin empleo #bilbao #3
"
"824","creo que podrían investigar qué otras ong están brindando apoyo en alimentación
actualmente para que nos lo indiquen en folletos #favorita#3
"
"825","aprobar el beneficio midiendo la necesidad de cada persona, mi hijo es
discapacitado, tiene 4 hijos pero no salió beneficiado #los robles #4
"
"826","ayudas de mercados cuando terminen el servicio pues los núcleos familiares están
conformados por niños y lo necesitamos. #suba #4
"
"827","para mostrar un apoyo más cercano, podrían visitarnos en  nuestros hogares al
menos en una ocasión durante el tiempo de servicio #cerezos #4
"
"828","por favor si van a cambiar la fecha de pago, notificar a través de sms porque no
está llegando el pago en la fecha acordada. #santa lucía #2
"
"829","citar a reuniones 1 día antes de la consignación para que nos den charlas sobre
el buen uso y distribución del cash, eso ayudaría #lisboa #5
"
"830","enviar vía sms información sobre cómo obtener el nuevo permiso migratorio a
todos los usuarios que lo necesiten, como en mi caso #la isla #3
"
"831","que envíen un sms indicando que ha realizado la consignación, así vamos al
cajero solo cuando esté el dinero disponible #panorama #3
"
"832","recomiendo expandir éste programa por todas las ciudades del país y que también
tengan en cuenta más población colombiana. #mártires #4
"
"833","manejar diferentes componentes no solo el económico, hay jóvenes que requieren
ayuda psicológica y restablecimiento de derechos. #miguel #2
"
"834","lo ideal sería que puedan ser constantes cada mes y que envíen el sms de
confirmación para no ir tantas veces a consultar saldo. #chucua #5
"
"835","convenir con una farmacia para que venda medicamentos más económicos a sus
usuarios, tengo que estar comprando anticonvulsivos #los reyes #5
"
"836","por favor explicar bien al principio en la reunión cuál es el mínimo de personas
que se pueden incluir en el núcleo familiar #san vicente #3
"
"837","me gustaría que citen a reunión presencial y expliquen más a detalle sobre esta
organización de dónde surgió y sus fundadores. #el carmen #2
"
"838","habilitar línea exclusiva para incluir familiares que no se encontraban al
momento de la caracterización, es el caso de mi hija #jardín #3
"
"839","solicitar al banco que aumente a 6 la cantidad de consultas gratuitas por mes,
para realizar los movimientos sin ningún temor #los robles #3
"
"840","efectuar convenio con una clínica que brinde atención pediátrica a hijos de las
usuarias, para que vean a mi hijo gratuitamente #florida #2
"
"841","como complemento a la ayuda sería bueno que brinden cursos a los jóvenes para
ampliar nuestras oportunidades laborales. #gaitana #2
"
"842","es oportuno hacer una visita al hogar del participante antes de aprobar el
servicio, algunos son beneficiados sin necesitarlo #aures ii #3
"
"843","instar al banco a que haga las mejoras necesarias a la página en la que se
consulta, pues pide usuario y clave pero no carga #bosa #3
"
"844","informar cuál será la fecha real del giro para evitar ir en vano al cajero
porque no está llegando en la fecha acordada. #isla del sol #2
"
"845","deseo que nos envíen video tutoriales cada mes sobre cómo realizar el retiro
correctamente, porque aún me parece confuso. #santa fé #2
"
"846","permitir que la persona sea inscrita con la copia del documento si no posee el
original, para que pueda recibir el beneficio #corinto #3
"
"847","apoyar los usuarios emprendedores con herramientas para que inicien un negocio,
necesito un calentador para vender empanadas #esperanza #4
"
"848","estimular a los usuarios a invertir el dinero en cosas necesarias, como la
alimentación y no lo malgasten como algunos hacen #verbenal #2
"
"849","preguntar a los participantes en las reuniones si conocen otras familias que
necesiten ayuda, para que brindemos sus datos #verbenal #3
"
"850","cuando llamen por primera vez, deben indicar de dónde obtuvieron la información
personal de la persona para generar confianza #salitre #5
"
"851","implementar más programas como éste pero dirigidos a mujeres de mayor edad que
ya no tienen una fuente de ingresos fija. #mártires #5
"
"852","a través de redes sociales publicar los anuncios sobre la realización de los
depósitos, estas; son un medio masivo efectivo. #cecilia #2
"
"853","antes de determinar el medio por el cual se recibirá la ayuda, llamar a
preguntar cuál de las opciones es viable para nosotros. #bilbao #4
"
"854","ayudar al usuario brindándole los elementos de trabajo que requiera para iniciar
un negocio, así progrese económicamente #rincón del lago #4
"
"855","realizar eventualmente reuniones con los usuarios en donde nos expliquen más
profundamente las funciones y servicios de  drc #l. c. galán #4
"
"856","apoyar adicionalmente a los adultos mayores con alimentos mensuales durante el
tiempo de servicio, el dinero no nos alcanza #san antonio #6
"
"857","realizar las caracterizaciones de manera presencial en los barrios vulnerables,
para identificar las familias más desfavorecidas #s. pedro#3
"
"858","en la página oficial se habla de otros servicios; sugiero que en la charla nos
hablen acerca de todos los beneficios que brindan #delicias#3
"
"859","sería muy positivo que nos remitan a agencias de colocación de empleo, así
podríamos acceder a un empleo digno. #chorrillos #4
"
"860","incluir el servicio de apoyo psicológico e incorporar una línea en donde podamos
recibir esa atención, me siento en depresión #esperanza #3
"
"861","disponer de un medio por el cual nos den orientación a los jóvenes sobre
institutos para retomar los estudios. #chorrillos #2
"
"862","enviar sms con link sobre diferentes temas referentes a la alimentación y
cuidado de la salud, aportarían a nuestros cuidado. #zelandia #4
"
"863","brindar talleres a los usuarios más jóvenes en oficios como panadería, para que
tengan más posibilidades de conseguir empleo #cazuca #2
"
"864","brindar capacitaciones en las que nos enseñen a cómo invertir el dinero, para
establecer un negocio que nos proporcione ingresos #rincón #3
"
"865","que la cantidad de colombianos beneficiados sea proporcional a la de migrantes,
noté que seleccionan mayormente a venezolanos #las cruces #2
"
"866","tener prioridad con personas de edad mayor y asignarles cita, tengo varias
comorbilidades y requiero atención médica #villa del diamante #5
"
"867","en la encuesta identificar si se cuenta con internet, de ser así; realizar
charlas mediante alguna app, sería muy bueno. #suba rincón #2
"
"868","recomiendo enviar un sms con la confirmación del depósito porque nunca voy en la
fecha indicada y debo esperar varios días. #bachué #2
"
"869","me gustaría que complementaran la ayuda con un kit escolar para niños, el cash
lo utilizo para alimentación y pagar arriendo. #el carmen #3
"
"870","tratar de ser puntuales con la confirmación del depósito, porque me llega el sms
días después de la fecha anunciada en reunión. #mártires #5
"
"871","habilitar línea telefónica en la que podamos solicitar el pago de 2 meses en 1
pero únicamente casos especiales, tuvimos covid. #lisboa #3
"
"872","indagar bien antes de entregar la ayuda a través de visita domiciliaria para
verificar si verdaderamente necesita el beneficio. #el oasis #3
"
"873","unir fuerzas con otra ong del área de salud, para que recibamos asistencia
médica durante el tiempo del servicio #sabanas de tibabuye #3
"
"874","habilitar un link que le permita a otras personas preinscribirse, para cuando
haya oportunidad evaluen su postulación a la ayuda. #pedro #3
"
"875","gestionar un costo mas bajo en la consulta de saldo aunque no es mucho, sería
ideal que el dinero se pueda retirar todo. #cantalejo #4
"
"876","sugiero no utilizar las entidades bancarias del grupo aval, sería mejor realizar
la consignación por el banco agrario. #eduardo santos #3
"
"877","hacer un estudio previo de los costos de arriendo y alimentación de los
encuestados y en base a eso determinar el valor a asignar #lijaca #2
"
"878","pido a nrc que nos brinde cursos para aprender artes como costura, tengo una
máquina de coser, así podría trabajar en eso #chorrillo #2
"
"879","crear una página web en donde podamos hacer consulta de saldo desde casa ya que
intente por la página del banco pero no funciona #ibaro i #3
"
"880","si el usuario presenta alguna discapacidad, estudiar su caso para que al final
sea remitido a otra ong que lo siga ayudando #s. carlos #2
"
